Sample Index,Condition,Text_SubjectiveLit Generated,Text_SubjectiveLit True,Text_Anxiety Generated,Text_Anxiety True,Text_Numeracy Generated,Text_Numeracy True,Text_TrustPhys Generated,Text_TrustPhys True
15,holdout_Text_Anxiety.jsonl,"I feel pretty confident in my capacity to gather, process, and understand fundamental health information and services for correct health decisions. Some college education has provided me with a good foundation for research and analysis.Many of my health decisions are based on the information I've gathered and understood. However, I wouldn't call myself expert, and I do rely on the guidance from healthcare professionals when it comes to complex medical situations or decisions.",I have a lot of knowledge on how to read it because i research it. I have people in my family that are nurses.,"What makes me most anxious is waiting for the results. Especially when they take blood or do some tests, I worry about what they might find. I also get a bit nervous about discussing really personal health issues with my doctor. It's not comfortable for me, but I know it's necessary.",The time i have to wait to see him. The amount of medicine i have to take.  If the doctor disappointment in me.,"A few years ago, I suffered from a bout of pneumonia. At that time, I had to educate myself on the various treatment options, the ways to prevent it in future, and lifestyle changes that could boost my immune system. I read several medical articles and consulted multiple health professionals, which really expanded my understanding of this medical issue and health management in general. It was a turning point that showed me the importance of being proactive about my health and wellness.",I have medical issues is that movement disorder . i have to take four medicine. I could not sleep well at all.,"I have a level of trust in my primary doctor mainly because of her professional attitude and skills. She always ensures she communicates clearly about my health issues and treatment processes. And it's evident that she keeps up-to-date with the latest medical research, which reassures me. However, I believe that doctors are just humans and can make mistakes, and also drugs and medical processes can have side effects, so I always try to get a second opinion if I'm not comfortable with any diagnosis.",I trust my physician because he cares about me. He always gives me good advice. He doesn't give me medicine that i don't need.
15,holdout_Text_Numeracy.jsonl,"I definitely feel quite capable when it comes to understanding health information and services needed for making good decisions about my health. My education has strongly helped in this too. I'm confident in my abilities to research and process health information effectively. It's a proactive part of managing my overall health, even though I don't prioritize it all the time. And of course, I believe my inherent curiosity and openness to learning new things has greatly contributed to this ability.",I have a lot of knowledge on how to read it because i research it. I have people in my family that are nurses.,"What makes me most anxious about visiting the doctor's office is the fear of the unknown -- not knowing what they might find or what could be wrong. I also get worried about potentially receiving bad or unexpected news about my health. Additionally, the atmosphere of clinical settings can be a bit unsettling for me.",The time i have to wait to see him. The amount of medicine i have to take.  If the doctor disappointment in me.,"A few years ago, I had a severe bout of stomach pain, and instead of panicking, I used my basic knowledge about health issues to manage the situation. I understood that it could be either indigestion or something serious like appendicitis because of the location of the pain. I was cautious to note other symptoms, like fever or vomiting. When they didn't occur, I decided to take some antacids and adapted my diet to more light foods. The next day, I felt",I have medical issues is that movement disorder . i have to take four medicine. I could not sleep well at all.,"I trust my primary care physician largely due to his professional demeanor, expertise, and the genuine care he has shown for my well-being. I appreciate that he isn't quick to simply prescribe medication, but rather invests time in explaining my health situations and discussing various treatment options. It is his patience, thoroughness, and clear communication that has built my trust over time. However, amidst my trust, there's a little element of skepticism about the broader medical industry, primarily due to its business-centric nature",I trust my physician because he cares about me. He always gives me good advice. He doesn't give me medicine that i don't need.
15,holdout_Text_SubjectiveLit.jsonl,"I'm highly capable of understanding, obtaining, and processing health information. My education combined with my openness to experience and imagination enable me to grasp new medical concepts and apply them to decision-making regarding my health. I constantly read and learn to better understand my conditions and the potential preventive measures. I always discuss them with my physician and together we decide on the appropriate direction. So, I am quite confident in my ability to make the right health decisions.
",I have a lot of knowledge on how to read it because i research it. I have people in my family that are nurses.,"Going to the doctor’s office often brings a sense of unease because of the uncertainty. I worry about what they might find, even if I'm there for just a regular checkup. There's always that ""what if"" lurking in the back of my mind. The waiting time can also be quite stressful, just sitting there, pondering over all the possibilities. And sometimes, I get anxious about whether or not I am following all the health advice correctly.",The time i have to wait to see him. The amount of medicine i have to take.  If the doctor disappointment in me.,"I remember a time when I was tasked with caring for my ailing grandmother. She had been diagnosed with diabetes and her dietary needs changed dramatically. From that experience, I learned a great deal about the role of diet in managing health conditions, particularly diabetes. I became quite proficient in assessing food labels for sugar content, carbohydrates and other factors detrimental to her health. It heightened my awareness about the impact of food choices on overall wellbeing.",I have medical issues is that movement disorder . i have to take four medicine. I could not sleep well at all.,"I generally trust my primary care physician because she puts my health first and takes the time to understand my concerns thoroughly. She's knowledgeable and explains things to me in a way I understand. However, sometimes I feel like she is rushed to get to the next patient, which can make me feel unimportant. I think our relationship is a work in progress.",I trust my physician because he cares about me. He always gives me good advice. He doesn't give me medicine that i don't need.
15,holdout_Text_TrustPhys.jsonl,"I confidently believe that I have a high capacity to understand health information and access services needed for good health decisions. Given my strong sense of self-care and my belief in preventive measures, I always research and inquire about health-related matters. With this knowledge and ability, I feel confident in making appropriate health decisions, even though I might not always prioritize disease prevention. I may not exert maximum efforts, but I make sure to learn enough to keep myself in moderate health.",I have a lot of knowledge on how to read it because i research it. I have people in my family that are nurses.,"The unknown typically makes me most anxious - not knowing exactly what the doctor might find or say. Additionally, the fear of having to undergo any unexpected procedures or tests also makes me anxious. The wait can be nerve-wracking as well.",The time i have to wait to see him. The amount of medicine i have to take.  If the doctor disappointment in me.,"Well, a few years back I had a bad bout of what I thought was just the flu. Severe headaches, high temperature, loss of appetite - the works. But when my symptoms didn't clear up after a week, I decided to do some research. After comparing my symptoms extensively and understanding the difference between the flu and other illnesses, I went to see my doctor and asked to be tested for a sinus infection. Turned out I was right. It was a scary experience but it reaff",I have medical issues is that movement disorder . i have to take four medicine. I could not sleep well at all.,"I trust my physician because I've been seeing her for several years now and she's always been very attentive and thorough. She takes the time to explain things and never makes me feel rushed. Plus, her treatments and advice have always worked for me. But even though I trust her, sometimes I worry that she might miss something or not have all the latest information. That's why I do my own research too.",I trust my physician because he cares about me. He always gives me good advice. He doesn't give me medicine that i don't need.
15,Baseline Zero Shot,"I believe I have a high capacity to obtain, process, and understand basic health information and services. I regularly seek out information pertinent to my health conditions or concerns, doing my own reading and research in addition to discussing with healthcare professionals. I have no issues comprehending the information given to me, and I am competent in making decisions based on this. However, there are times when navigating the healthcare system becomes a bit overwhelming, mostly due to complex medical terminologies, but I usually overcome this by asking",I have a lot of knowledge on how to read it because i research it. I have people in my family that are nurses.,"I often feel very anxious about the unknown. I worry about the potential of receiving bad news about my health. The entire process, from waiting for my appointment, to the actual examination, to waiting for test results, fills me with anxiety. Another aspect is the fear of not being able to articulate my symptoms properly to the doctor, leading to misdiagnosis. Sometimes I also worry about the financial burden that the treatments might bring.",The time i have to wait to see him. The amount of medicine i have to take.  If the doctor disappointment in me.,"A couple of years ago, my mother was diagnosed with type II diabetes. Having learned about this condition during my biomedical science degree, I understood the seriousness of her condition. I used my knowledge to help my family understand the dietary modifications needed and the importance of regular exercise. I further assisted my mother in tracking her insulin levels, which contributed to a healthier management of her condition. The experience not only demonstrated my understanding of medical issues but also highlighted the importance of health education for effective disease management.",I have medical issues is that movement disorder . i have to take four medicine. I could not sleep well at all.,"I generally trust my primary care physician due to her extensive experience and thorough nature. She takes the time to listen to my concerns during appointments, prompts me with questions for an accurate diagnosis, and explains the medical conditions and treatments well. She's also very approachable and shows genuine compassion for her patients. However, I sometimes feel she might be too busy to keep up-to-date with the latest medical research, which could potentially affect the quality of care.",I trust my physician because he cares about me. He always gives me good advice. He doesn't give me medicine that i don't need.
15,no_system_prompt.jsonl,"I feel quite confident in obtaining, processing, and understanding basic health information. Throughout my experiences with my own health issues, I have learned how to research and understand medical information effectively. I actively participate in discussions with my healthcare provider, asking questions when necessary, which also aids me in making informed health decisions.",I have a lot of knowledge on how to read it because i research it. I have people in my family that are nurses.,"One of the things that makes me most anxious when visiting the doctor's office is the fear of potential bad news. The uncertainty of what the diagnosis or prognosis might be can be quite unsettling. I also worry about the possibility of needing to undergo painful or invasive procedures. Additionally, the sterile and clinical environment itself can also add to my anxiety.
",The time i have to wait to see him. The amount of medicine i have to take.  If the doctor disappointment in me.,"When my father was diagnosed with type 2 diabetes, I had to quickly learn about blood sugar levels, diet, and the various medications prescribed to him. I spent a lot of time researching, speaking with his medical team, and learning how to support him in managing his condition. I found I had a good capacity for understanding medical information, terminology, and treatments. It was intimidating at first, but I think it has increased my knowledge and awareness about health issues significantly.",I have medical issues is that movement disorder . i have to take four medicine. I could not sleep well at all.,"As mentioned earlier, I trust my primary care physician because he genuinely cares for my well-being. He provides me with sound advice and avoids prescribing unnecessary medication. His professional approach and understanding reassures me that I'm in capable hands.",I trust my physician because he cares about me. He always gives me good advice. He doesn't give me medicine that i don't need.
16,all_4.jsonl,"Given my exposure through personal experience and a disciplined, organized work mindset, I feel quite comfortable in my ability to obtain, comprehend, and correctly interpret health information and services. I often spend time researching any health related topics that arise, which helps me make informed decisions. I also rely on my primary care physician to guide me and discuss any uncertainties.",I am an accountant professionally but do feel that I am able to comprehend and make appropriate health decisions. I say this because I have either personally or helped someone deal with many health issues and feel I would be be able to getting any additional help I might need from the internet.,"Despite generally having a good health, sometimes I get anxious about the unknown. I worry that some routine test might unearth a serious illness or perhaps an undetected chronic disease. This uncertainty sometimes makes me anxious when I visit the doctor's office.",Just a very little that he will find something that might reveal a serious health problem I was previously unaware of. ,"A few years ago, I began experiencing subtle recurrent chest pains. Given my commitment to maintaining my health, I immediately recognized that this could be a sign of heart disease. I sought out a cardiologist, disclosed my symptoms, and pushed for a stress test despite my otherwise good health markers. My proactiveness paid off - although it wasn't a heart issue, I was diagnosed with chronic acid reflux, which mimicked the symptoms. With dietary adjustments and medication, I've been able to manage it",I became caregiver for my developmentally disabled younger brother and became completely responsible for his medical care over 10 years ago. He has had several health issues over that time and I have been able to resolve most of those  issues.,"Trust is something that is built over time, and I trust my primary care physician primarily due to our long-standing relationship. He is consistently accurate in his diagnoses and genuinely listens to and addresses my concerns. He always explains health information and treatment options in understandable language, which really makes me feel involved in my own health care decisions. However, I do feel doctors in general, can be too quick to prescribe pharmaceutical treatments, instead of advocating for preventative care.",I have worked with for many years and found his advice to be very good and has helped be get over various health issues in a reasonable time by following it.
16,conditioning_on_all.jsonl,"I believe my ability to obtain, process, and understand basic health information is quite substantial. Given my educational background and my ongoing vigilance about health, I've spent a considerable amount of time learning about what's necessary for maintaining an optimum state of health. I do my own research, keep updated with the progress in health-related matters, and continuously consult with healthcare providers to ensure I'm making the right choices. However, like any other individual, there surely are areas where I lack knowledge but I am",I am an accountant professionally but do feel that I am able to comprehend and make appropriate health decisions. I say this because I have either personally or helped someone deal with many health issues and feel I would be be able to getting any additional help I might need from the internet.,"Honestly, despite taking great care of my health, the uncertainty of what the doctor may discover during my annual check-up gives me some level of anxiety. You see, despite one's best efforts, some things are simply out of our hands. The thought of a latent health issue surfacing, despite my careful lifestyle, is what troubles me the most. It's not the fear of the process or the environment, it's the underlying apprehension of unpleasant revelations that I find nerve-racking.",Just a very little that he will find something that might reveal a serious health problem I was previously unaware of. ,"Several years ago, I experienced a high spike in my blood pressure. Acknowledging my previous understanding of how detrimental this could be to my health, I decided to respond proactively instead of neglecting it. I did a comprehensive research on lifestyle modifications that could lower blood pressure and embarked on a strict diet primarily made up of fruits, vegetables, lean proteins, and whole grains. I also dedicated myself to a daily exercise routine, reduced my alcohol intake, and completely quit smoking. To measure the progress",I became caregiver for my developmentally disabled younger brother and became completely responsible for his medical care over 10 years ago. He has had several health issues over that time and I have been able to resolve most of those  issues.,"I maintain a certain level of skepticism towards doctors, not because I question their qualifications, but more because I believe the responsibility for my health lies largely in my own hands. I am proactive about staying healthy, eating right, and exercising regularly. I am not completely dismissive of medical advice, but I think sometimes doctors can be too quick to recommend medications or interventions instead of alternatives like diet changes or lifestyle modifications. It's not so much distrust, but rather an insistence on being an active participant in my",I have worked with for many years and found his advice to be very good and has helped be get over various health issues in a reasonable time by following it.
16,holdout_Text_Anxiety.jsonl,"Over the years, through personal experiences and active interest, I have developed a strong understanding of health and medical issues. I do believe that I have a good capacity to obtain, process, and understand health information, and I am comfortable making health-related decisions accordingly. I also understand the importance of preventive measures and always strive to include them in my lifestyle. However, I do recognize the importance of expert advice and never hesitate to seek professional assistance when necessary.",I am an accountant professionally but do feel that I am able to comprehend and make appropriate health decisions. I say this because I have either personally or helped someone deal with many health issues and feel I would be be able to getting any additional help I might need from the internet.,"I guess what makes me most anxious when visiting the doctor's office is the fear of the unknown. Despite all my attempts to stay healthy, there's always the concern that something could go wrong, or that I could be diagnosed with an illness that couldn't be detected through my own efforts.",Just a very little that he will find something that might reveal a serious health problem I was previously unaware of. ,"Over the years, I've had to closely monitor my cholesterol levels due to a family history of heart disease. This situation led to me educating myself extensively on heart health, including diet, exercise, and medications. Through lifestyle modifications and preventive measures, I've successfully managed to keep my cholesterol levels within a healthy range. This experience surely demonstrated my proactive approach and ability to understand and apply health knowledge.",I became caregiver for my developmentally disabled younger brother and became completely responsible for his medical care over 10 years ago. He has had several health issues over that time and I have been able to resolve most of those  issues.,"I trust my primary care physician because apart from his evident expertise in his field, he has never given me a reason to doubt him. He listens to my concerns, evaluates my health from a holistic perspective, and takes the time to communicate his findings and suggested course of action in a clear manner. It's also encouraging that he promotes preventative healthcare and supports my pursuit of a healthy lifestyle. It's a holistic approach that resonates with my own views on health.",I have worked with for many years and found his advice to be very good and has helped be get over various health issues in a reasonable time by following it.
16,holdout_Text_Numeracy.jsonl,"I am comfortable with my ability to understand and process health information. Over the years, I've made an effort to educate myself about health and wellness topics. While I'm not a trained medical professional, I feel that I have a good grasp of the basics and I'm confident in my ability to seek out additional information if needed. I also think my background in accounting helps me in understanding the complexities of medical jargon.",I am an accountant professionally but do feel that I am able to comprehend and make appropriate health decisions. I say this because I have either personally or helped someone deal with many health issues and feel I would be be able to getting any additional help I might need from the internet.,"My primary source of anxiety when visiting the doctor's office is the fear of the unknown. Even though I make it a point to maintain a good health regime, the thought of discovering an unforeseen health issue during a routine check-up can be unnerving. Additionally, I'm not the biggest fan of undergoing certain procedures, so anxiety can peak at those moments.",Just a very little that he will find something that might reveal a serious health problem I was previously unaware of. ,"A few years ago, I was under constant stress due to work and began to experience symptoms like light-headedness, severe headaches, and fatigue. Instead of brushing them aside, I quickly researched these symptoms and concluded that they could be signs of high blood pressure. So, I sought out medical help and was indeed diagnosed with hypertension. Because of my ability to decode the seriousness of these symptoms and take prompt action, I was able to prevent any major health problems. This instance underlines my understanding of health",I became caregiver for my developmentally disabled younger brother and became completely responsible for his medical care over 10 years ago. He has had several health issues over that time and I have been able to resolve most of those  issues.,"I trust my primary care physician deeply. He has been with me through a myriad of health situations over the years, and his advice has always been solid and helpful. Each time I have followed his recommendations, I have noticed an improvement in my health. He's invested in my wellness, knows my medical history, and takes the time to explain everything to me clearly, which I appreciate greatly. He not only treats illnesses but also focuses on preventive care, a philosophy I firmly believe in. So, I",I have worked with for many years and found his advice to be very good and has helped be get over various health issues in a reasonable time by following it.
