Sample Index,Condition,Text_SubjectiveLit Generated,Text_SubjectiveLit True,Text_Anxiety Generated,Text_Anxiety True,Text_Numeracy Generated,Text_Numeracy True,Text_TrustPhys Generated,Text_TrustPhys True
7,holdout_Text_Numeracy.jsonl,"I believe that I have a decent capacity to obtain, process, and understand basic health information. I've attended some college, so I'm used to learning new information and can understand most of what my doctor tells me. I don't always prioritize my health as much as I should, but when I need to make important health decisions, I feel equipped to do so. However, I can admit that sometimes, complex medical jargon can be a bit overwhelming.",i am not that old for me not to understand what the doctors trying to say. i am having trouble to read their writings but pharmacy can do it for me. so i am certain that i can get what i needed,"I would say, it's the anticipation of the unknown that worries me the most. I find myself anxious about what the doctor might discover or say about my health. It's not so much about the routine procedures, but more about the potential of receiving bad news or discovering a health problem I wasn't aware of.",when they are talking about serious health problem. a words from him that might lead to a bad health issue. testing my blood for std and other lifetime problems,"not too long ago, i got this really bad heartburn that wouldn't go away. i tried antacids, but they weren't working. eventually, i did some research and figured it might be acid reflux. i went to the doctor and turns out i was right. we started a treatment and it's been a lot better since then. it made me realize that having some basic understanding of common health issues can really help in taking care of your health.",i work as a nurse before. they teach us how to takes care of a patient and first aid. i didn't finish it but i have knowledge about it.,"I trust my primary care physician because he's been our family doctor for years. He's seen me through some tough times and has always been upfront about my health. His approach is holistic, he talks about the importance of lifestyle along with medication, which I greatly appreciate. But, it's not the same with all doctors. For other doctors, I want to feel that they truly care about my well-being, but sometimes it feels like they're just going through the motions or rushing through appointments. That","our doctor is well known in my community and he is our family doctor. my mom trust him, so i trust him too. but talking to other doctors, i test them first by asking a lot of questions before i can trust them"
7,holdout_Text_SubjectiveLit.jsonl,"I think I have a pretty good grasp of how to access and comprehend health information, having had some college education. While I'd say I'm not expert, I'm often able to make the right decisions based on what I know and from my personal experiences. When I'm unsure, I’ll seek advice from trusted sources like my primary care doctor or look for reliable information online.",i am not that old for me not to understand what the doctors trying to say. i am having trouble to read their writings but pharmacy can do it for me. so i am certain that i can get what i needed,"What heightens my anxiety is the uncertainty, waiting for results, especially if I've been experiencing unexplained symptoms. Despite my efforts to live healthily, I sometimes worry that I've neglected something and that it might have serious consequences. Also, I get anxious when I think that the doctor might find something unexpected.",when they are talking about serious health problem. a words from him that might lead to a bad health issue. testing my blood for std and other lifetime problems,"A few years ago, I had a minor heart scare. I experienced chest pain and shortness of breath. Because of my basic knowledge of health issues, I recognized these as symptoms of a potential heart condition, and I immediately went to the hospital. Turned out it was just stress and anxiety, but it felt good to know that I was able to recognize the signs and acted accordingly. This incident really showed me the importance of understanding basic health and medical information.",i work as a nurse before. they teach us how to takes care of a patient and first aid. i didn't finish it but i have knowledge about it.,"I trust my primary care physician mainly because he has built a solid reputation within our community. This trust isn't blind though; it's a result of observing his competence, knowledge, and bedside manner over the years. However, when it comes to new doctors or specialists, I tend to be more cautious. I ask questions and gauge their responses to determine whether or not I can trust them. Building trust with a doctor doesn't happen instantly; it takes time and discernment.","our doctor is well known in my community and he is our family doctor. my mom trust him, so i trust him too. but talking to other doctors, i test them first by asking a lot of questions before i can trust them"
7,holdout_Text_TrustPhys.jsonl,"I believe I have a fairly good ability to obtain, process, and understand health information. My previous nursing experience allows me to grasp medical terms and concepts better than most. I will say that it can be overwhelming at times, particularly with complex health issues or treatments, but I generally try to take the time to do my own research and ask the doctors any questions I may have. It helps me to make better decisions regarding my health care.",i am not that old for me not to understand what the doctors trying to say. i am having trouble to read their writings but pharmacy can do it for me. so i am certain that i can get what i needed,"Honestly, just the overall uncertainty can really eat at me. I worry about the potential for unforeseen issues, the dreaded wait for test results, the unknown. It's not knowing that wrenches my gut. I also always have this nagging fear of being judged or lectured about my lifestyle choices. It's not always easy to make the best choices and the feeling of guilt can sometimes hover over me in the doctor's office.",when they are talking about serious health problem. a words from him that might lead to a bad health issue. testing my blood for std and other lifetime problems,"Well, a couple of years back, I twisted my ankle pretty badly while playing basketball. I remembered what I learned about RICE - Rest, Ice, Compression, Elevation. I followed that, took over-the-counter anti-inflammatories, and didn't rush putting weight on it again. I probably saved myself a more serious injury and a trip to the ER. It taught me the value of knowing how to handle common health issues on my own.",i work as a nurse before. they teach us how to takes care of a patient and first aid. i didn't finish it but i have knowledge about it.,i trust them a lot. they spent years of studying just to get their license. they are highly qualified to talk about medical issue. but some doctor might buy medicine with high cost for them to get commission. that's what i heard.,"our doctor is well known in my community and he is our family doctor. my mom trust him, so i trust him too. but talking to other doctors, i test them first by asking a lot of questions before i can trust them"
7,Baseline Zero Shot,"I feel like I have a substantial capacity to obtain, process, and understand basic health information and services necessary for making health-related decisions. Having a background in science, I'm fairly adept at understanding medical jargons, and I'm quite comfortable with technology which allows me to easily access and process health-related information online. However, I might still need certain clarifications with complex medical situations which I think is normal. Overall, I feel confident in my ability to comprehend health information and make informed decisions,",i am not that old for me not to understand what the doctors trying to say. i am having trouble to read their writings but pharmacy can do it for me. so i am certain that i can get what i needed,"The uncertainty and anticipation of the unknown often makes me anxious when visiting the doctor's office. I worry about potentially receiving bad news regarding my health, or that my symptoms might lead to a serious diagnosis. I'm also anxious about undergoing invasive or uncomfortable medical procedures. Other times, it's the fear of not being taken seriously or that my concerns might be misunderstood or brushed off. The sterile, clinical environment can also make me feel uneasy.",when they are talking about serious health problem. a words from him that might lead to a bad health issue. testing my blood for std and other lifetime problems,"In my early twenties, I faced a rather serious kidney issue. What initially started as an unnoticed infection escalated to unbearable pain, which led to an emergency room visit. Having a medical background in nursing, I knew the importance of seeking immediate medical treatment to mitigate the injury. Throughout my hospitalization, my prior knowledge helped me understand my diagnosis, treatment plan, and medication regimen. This experience further solidified my understanding of health issues and the importance of preventive care.",i work as a nurse before. they teach us how to takes care of a patient and first aid. i didn't finish it but i have knowledge about it.,"I trust my primary care physician quite a bit. I've been seeing her for several years now and she has always been very transparent and straightforward with me about my health conditions. Plus, she often goes out of her way to explain complex medical jargon in a way that I can understand, which I greatly appreciate. Additionally, she remains respectful of my concerns and is always ready to address any doubts or queries that I have. Finally, she has shown her competence by accurately diagnosing my health issues,","our doctor is well known in my community and he is our family doctor. my mom trust him, so i trust him too. but talking to other doctors, i test them first by asking a lot of questions before i can trust them"
7,no_system_prompt.jsonl,"I believe I have a high degree of capacity to obtain, understand, and process basic health information. My previous work experience as a nurse provided me with knowledge and understanding about health matters. Furthermore, thanks to my proactive nature, I regularly stay informed about health trends and research studies, which enhance my ability to make suitable health decisions.",i am not that old for me not to understand what the doctors trying to say. i am having trouble to read their writings but pharmacy can do it for me. so i am certain that i can get what i needed,"The moments that make me feel most anxious during a visit to the doctor's office are usually related to waiting for results. I get worried when I think about the potential unknown issues that could be revealed. I also feel anxious when I have to undergo certain medical procedures, especially ones that are invasive or involve needles.",when they are talking about serious health problem. a words from him that might lead to a bad health issue. testing my blood for std and other lifetime problems,"My grandmother was diagnosed with diabetes, and I took on the responsibility of helping her manage her condition. I researched about diabetes extensively and learnt about blood sugar levels, insulin, nutrition, and the importance of regular exercise. I helped her along with her medication, dietary changes and regular checkups. This experience considerably expanded my understanding and knowledge of this particularly pervasive health issue.",i work as a nurse before. they teach us how to takes care of a patient and first aid. i didn't finish it but i have knowledge about it.,"I trust my primary care physician because he has always been thorough and patient while explaining my health issues, which shows that he genuinely cares for his patients. He listens to my concerns without rushing, and provides detailed responses. There have been instances when I've second guessed the course of treatment or had doubts about a diagnosis, but he's always taken the time to reassure me and give me the necessary information. If I'm still not convinced, he's open to considering my perspective and discussing alternatives. This has","our doctor is well known in my community and he is our family doctor. my mom trust him, so i trust him too. but talking to other doctors, i test them first by asking a lot of questions before i can trust them"
8,all_4.jsonl,"Given that I strive to make a conscious effort to live healthily and prevent disease, I believe I have a reasonable capacity to obtain, process, and understand basic health information. Although I don't do everything within my capacity, I feel capable of making appropriate health decisions based on the information provided to me. If there's something I don't understand, I'm not afraid to ask questions or seek further information.","All health information should be presented to me and if I am confused about something, I should be able to ask question and given reasonable answers. ",I'm always worried that they might discover a serious health issue that I'm not prepared to handle. I'm also nervous about undergoing certain procedures or tests that might be uncomfortable or painful. I often worry about the results of those tests too.,I fear that they will find something life threatening to me or my child. Or that I failed one of my blood test ,"In the past I actively advocated for my own health when I was diagnosed with iron-deficiency anemia. I researched and learned about different types of foods that are iron-rich, and started incorporating them into my daily meals. Over time, I was able to improve my iron levels and mainly manage my condition through diet, which felt like a great accomplishment. It showed me the importance of being proactive about my own health.",I was tested for my iron level while pregnant and it came back 10.7. Pregnant women iron level is suppose to be at a 12,"I feel mixed feelings about doctors in general. On one hand, I understand they are professionals who are trained to help, treat illnesses and save lives. Still, I can't help but feel worry about the healthcare system sometimes. I don't always feel like they are as attentive as they should be, especially for people who don't have as much money to spend or the best insurance coverage. I just hope they always put my well-being and health before anything else. Plus I've heard so many stories",I trust my OBGYN caregiver because she is always honest and answers any of my questions with not only her professional opinion but based on her experience 
8,conditioning_on_all.jsonl,"Well, I'd say that I'm relatively well-equipped to make sound health decisions. I've got the basics down and continually try to inform myself about healthy living, planning meals and practices that are good for my health. I'm still on a learning curve though and there's a lot more I need to know. I sometimes have a hard time processing all the conflicting health information that's out there, and I think that's one area I struggle with. So, I wouldn't say I'm at","All health information should be presented to me and if I am confused about something, I should be able to ask question and given reasonable answers. ","To be honest, I get anxious about the unknown. I mean, I'd rather know what's wrong than not know, but the anticipation of waiting for test results or a diagnosis tends to send my thoughts into overdrive. I worry about whether I've been doing enough to take care of my health, given my financial situation. It's not like I can afford every health enhancing or preventive measure out there. Then, I'm an introverted person so the whole ambiance of the doctor's office,",I fear that they will find something life threatening to me or my child. Or that I failed one of my blood test ,"Before I moved out of my parents' house, I took care of my grandmother who had Type 2 diabetes. I had to learn things like checking her blood sugar levels, managing her diet, and ensuring she took the appropriate medications at the right times. I also regularly researched online to understand better how to help her manage the disease. It wasn't easy, but I genuinely believe that my dedication to helping her stay healthy extended her life.",I was tested for my iron level while pregnant and it came back 10.7. Pregnant women iron level is suppose to be at a 12,"I've always had mixed feelings about doctors. On one hand, I understand they've undergone extensive training and have a vast knowledge about health and wellness that I can trust. On the other hand, I've had experiences where I felt like I wasn't truly heard or understood by my doctor, which has led to some distrust. Also, sometimes I wonder whether they genuinely care about my health or if they are more focused on their paycheck. It's a tough balance because I want to trust them, but",I trust my OBGYN caregiver because she is always honest and answers any of my questions with not only her professional opinion but based on her experience 
8,holdout_Text_Anxiety.jsonl,"I believe I have a good capacity to obtain, process, and understand basic health information. I prioritize staying on top of my routine check-ups, and I make it a point to ask my doctor any questions or clarify any concerns I may have about my health. However, there's always room for improvement and learning, especially when it comes to some medical terminologies.","All health information should be presented to me and if I am confused about something, I should be able to ask question and given reasonable answers. ","What worries me most when visiting the doctor's office is the fear that they might discover a serious health issue. No matter how well I feel, the uncertainty until getting the test results always leaves me feeling anxious.",I fear that they will find something life threatening to me or my child. Or that I failed one of my blood test ,A few months ago I had experienced severe headache and unusual fatigue. I didn't ignore the symptoms and decided to visit a clinic. I described my conditions and the doctor suggested to check my blood pressure. It turned out I had high blood pressure. I knew that constant headaches and fatigue could be a symptom of high blood pressure because my mother has the same issue. I recognized the signs from her experience which led me to seek the necessary medical assistance in a timely manner.,I was tested for my iron level while pregnant and it came back 10.7. Pregnant women iron level is suppose to be at a 12,"I don't have a primary care physician right now, but regarding doctors in general, I try to keep a balanced perspective. It really depends on the doctor's attitude towards me and my concerns. I value empathy, listening skills and honest communication when it comes to doctors. I tend to trust those who respect my own knowledge and are patient in explaining any medical concepts I might not understand. I'm wary of those who seem dismissive or rushed.",I trust my OBGYN caregiver because she is always honest and answers any of my questions with not only her professional opinion but based on her experience 
8,holdout_Text_Numeracy.jsonl,"I believe I have a good capacity to obtain, process, and understand basic health information. I may not know all the medical terms or nuances, but I won't hesitate to ask for clarification. Despite the gap in my income, I have always prioritized health and wellness, so making appropriate health decisions is not really foreign to me.","All health information should be presented to me and if I am confused about something, I should be able to ask question and given reasonable answers. ",The thing that makes me most anxious when visiting the doctor's office is the fear of the unknown. I always worry that they might discover a serious health issue during examinations or tests. I also get nervous about procedures or treatments because I don't like the feeling of not being in control.,I fear that they will find something life threatening to me or my child. Or that I failed one of my blood test ,"When I first found out I was pregnant, I had to quickly learn about prenatal care, what to expect during my pregnancy, how to take care of myself and the growing baby. This has significantly increased my understanding of health and medical matters and taught me how to navigate the healthcare system as well.",I was tested for my iron level while pregnant and it came back 10.7. Pregnant women iron level is suppose to be at a 12,"Generally, I trust doctors because they are knowledgeable and experienced in their field. However, sometimes I feel their time is often rushed and they might not fully address my concerns. This inability to have my concerns completely addressed can cause a little bit of distrust.",I trust my OBGYN caregiver because she is always honest and answers any of my questions with not only her professional opinion but based on her experience 
8,holdout_Text_SubjectiveLit.jsonl,"I feel confident in my ability to obtain and understand basic health information. I take time to research and ask my healthcare provider questions about any health issues that concern me. However, sometimes medical jargon can be a bit overwhelming, and I may not fully grasp every detail. Overall, I believe that I make informed health decisions most of the time.","All health information should be presented to me and if I am confused about something, I should be able to ask question and given reasonable answers. ",I often feel most anxious about the potential of receiving bad news. The uncertainty around tests and results can be nerve-wracking. The fear of finding out I might have a serious health issue is deeply unsettling. I also worry about being judged or not taken seriously by the doctor.,I fear that they will find something life threatening to me or my child. Or that I failed one of my blood test ,"When I was in high school, I took a health and wellness class where I learned the importance of maintaining a balanced diet and regular exercise. As part of the class, I also learned to recognize certain symptoms and provide basic first aid. Once, my younger sister started feeling faint and dizzy. I noticed her symptoms matched with dehydration. I quickly made her sit down, gave her water to drink and some salty snacks to balance the electrolytes. She felt better afterwards. That experience proved to me that basic",I was tested for my iron level while pregnant and it came back 10.7. Pregnant women iron level is suppose to be at a 12,"There's a certain level of trust I have towards my primary care physician primarily because they're certified and have years of professional training and experience. I trust that they're knowledgeable on a wide range of health-related subjects. However, there remains a level of distrust as well, mainly stemming from the fact I am often aware that they might not fully comprehend my personal experience or how my body is going to react to specific treatments or medications. Finally, being a person of color, I can't entirely shake off",I trust my OBGYN caregiver because she is always honest and answers any of my questions with not only her professional opinion but based on her experience 
8,holdout_Text_TrustPhys.jsonl,"I believe I have a fair capacity to obtain, process and understand basic health information. I try to stay informed about general health recommendations and common diseases. If it's too complex, I get overwhelmed, but if a health professional explains it in a way I can understand, I can use the information for my benefit.","All health information should be presented to me and if I am confused about something, I should be able to ask question and given reasonable answers. ","One of the things that makes me most anxious when visiting a doctor's office is the fear of being diagnosed with a disease or illness. It's always in the back of my mind that the doctor might find something wrong with me that I was unaware of. I also feel a bit worried about the potential costs, given my limited income. Lastly, there's always a bit of unease not fully understanding medical jargon and trying to make decisions based on that information.",I fear that they will find something life threatening to me or my child. Or that I failed one of my blood test ,"During my run for the last year's annual community marathon, I had a sudden acute chest pain making it hard for me to breathe. But having attended a basic health training workshop, I recognized this as a sign of dehydration. I quickly reached for my water bottle, took slow and deep breaths, and luckily, the discomfort subsided. It could have been worse, but knowing the basic health information made me manage the situation effectively.",I was tested for my iron level while pregnant and it came back 10.7. Pregnant women iron level is suppose to be at a 12,"I lack trust in my primary care physician because every time I visit, it's always a different doctor. It's difficult to develop a bond or trust when you're constantly meeting new faces. Plus, I often feel they are rushed and not giving me the complete attention I deserve during our consultations.",I trust my OBGYN caregiver because she is always honest and answers any of my questions with not only her professional opinion but based on her experience 
