Sample Index,Condition,Text_SubjectiveLit Generated,Text_SubjectiveLit True,Text_Anxiety Generated,Text_Anxiety True,Text_Numeracy Generated,Text_Numeracy True,Text_TrustPhys Generated,Text_TrustPhys True
23,all_4.jsonl,"While I feel I have the capacity to obtain and process basic health information, understanding it to the point of making appropriate health decisions can sometimes be a challenge. How much of that knowledge is applicable to me, or the context it falls into with my personal health can often cloud my judgment. In terms of health services, navigating them can be complicated because they involve factors not only related to health but also factors like cost, which further complicates things given my financial situation. But overall, I would say I","I have the capacity to obtain, process, and understand basic health information. The problem is whether I am informed enough to make appropriate health decisions regardless of how many questions I ask. If I need to know something it should be TOLD to me, and if I need a procedure immediately it should be scheduled immediately instead of them ignoring me for a month and setting up an entirely different procedure without consulting anyone before a different doctor tells me that I needed something different the whole time.","I've mentioned financial concerns previously, but I also worry about being dismissed or not being taken seriously. I'm anxious that the doctor might overlook or misdiagnose something, since I don't always prioritize my health. It's congested with the constant worry that something might be wrong and it wouldn't get caught in the early stages because of my lack of proactive healthcare habits.","Money. I have no insurance so if there's something serious and I have to be rushed to the hospital, I will never be able to pay for it. I would rather they just leave me on the examination table to die than help at that point. I'm already in debt because of college loans; I literally can't afford to be in any more debt than I already am.","Well, I had quite an experience a few years back when my grandmother was diagnosed with Alzheimer's. With family living far away, I voluntarily took up the task of caring for her as she was also living alone. I had to educate myself about her condition, about the progression, symptoms, the care needed, and even the medications she had to take. It certainly made me understand that managing a health condition goes beyond just knowledge of the disease; it requires compassion, understanding, and patience.","My mother was recently treated for breast cancer and just had her third of four chemotherapy sessions. She was initially told that she would not need chemo at all and would just have to do radiation to lower the rate of recurrence after the tumor and a lymph node was removed, and then a month later she had to very quickly reschedule, messing up work and therefore putting her insurance at risk. All of the complaints I've given you so far are incredibly fresh in my mind.","I have mixed feelings about doctors in general. On one hand, I honor their dedication and technical knowledge. There's no denying they have gone through rigorous training to get where they are. On the other hand, I can't help but feel like sometimes, their primary focus may be disease treatment and not necessarily patient wellness. I've experienced situations where I felt left behind and overlooked after a procedure was done, and where my concerns were dismissed. Hence, the trust isn't as solid as I would like","So the surgery went incredibly well with only one nurse having poor bedside manner. The issue was the follow-up procedures. Radiation was all set up and ready to go before a sudden visit to the oncologist was scheduled. And we were informed that we were a month behind schedule. After that, suddenly radiation had to be pushed back over two months so four sessions of chemo could be forced through. We don't go to the first surgeon/general practitioner anymore. Apparently that's common with most surgeons: once they're done with you, you yourself don't need help anymore, even if you clearly do."
23,conditioning_on_all.jsonl,"I wouldn't say I'm an expert by any means when it comes to understanding health information and services, but I am certainly capable of obtaining and interpreting basic information. When it comes to making appropriate health decisions, I'm confident in my judgment, but sometimes it isn't a priority for me. My health is important of course, yet I also believe that it's not solely reliant on my actions. Rather, I believe it's a combination of various factors, some of which are beyond my control.","I have the capacity to obtain, process, and understand basic health information. The problem is whether I am informed enough to make appropriate health decisions regardless of how many questions I ask. If I need to know something it should be TOLD to me, and if I need a procedure immediately it should be scheduled immediately instead of them ignoring me for a month and setting up an entirely different procedure without consulting anyone before a different doctor tells me that I needed something different the whole time.","My greatest anxiety when visiting a doctor's office is related to my health outlook. I struggle with the belief that, no matter how much I try to take care of my health, it isn't significantly influenced by my efforts, making me worry about potential health problems that could arise. Another trigger of anxiety for me is the sense of loss of control and uncertainty, not knowing what the doctor might find during a check-up. It is somewhat against my nature, as I consider myself pretty organized and orderly in","Money. I have no insurance so if there's something serious and I have to be rushed to the hospital, I will never be able to pay for it. I would rather they just leave me on the examination table to die than help at that point. I'm already in debt because of college loans; I literally can't afford to be in any more debt than I already am.","A couple of years back, I was living with a few roommates who regularly went to the gym and ate very health-conscious meals. Their health-focused lifestyle rubbed off on me to an extent. I began to learn about different diets and exercise routines, like keto and HIIT. However, when I fell ill and got a nasty cold, I realized simply eating right and exercising was not enough. Despite my efforts, I still got sick, which highlighted the fact that there were other factors involved in maintaining","My mother was recently treated for breast cancer and just had her third of four chemotherapy sessions. She was initially told that she would not need chemo at all and would just have to do radiation to lower the rate of recurrence after the tumor and a lymph node was removed, and then a month later she had to very quickly reschedule, messing up work and therefore putting her insurance at risk. All of the complaints I've given you so far are incredibly fresh in my mind.","I trust my primary care physician mainly because of their extensive education and experience in the field. They are experts who are well-equipped to guide me on health matters, even though I believe a lot is beyond control when it comes to health. That says, right or wrong, I'm not fully convinced that following their advice will guarantee excellent health. It seems to me there's a lot of luck, which is out of my hands. I push myself to develop a good rapport with them and generally follow their","So the surgery went incredibly well with only one nurse having poor bedside manner. The issue was the follow-up procedures. Radiation was all set up and ready to go before a sudden visit to the oncologist was scheduled. And we were informed that we were a month behind schedule. After that, suddenly radiation had to be pushed back over two months so four sessions of chemo could be forced through. We don't go to the first surgeon/general practitioner anymore. Apparently that's common with most surgeons: once they're done with you, you yourself don't need help anymore, even if you clearly do."
23,holdout_Text_Anxiety.jsonl,"To an extent, I believe I have the capacity to obtain, process, and understand basic health information, and arguably the services needed to make appropriate health decisions. However, what troubles me is knowing if the decisions I make are indeed the right ones, as the medical field can be quite complicated and overwhelming. I believe it's not just about having the information but being able to fully comprehend it in a way that ensures the best health decisions are made. It's also about how I prioritize my health,","I have the capacity to obtain, process, and understand basic health information. The problem is whether I am informed enough to make appropriate health decisions regardless of how many questions I ask. If I need to know something it should be TOLD to me, and if I need a procedure immediately it should be scheduled immediately instead of them ignoring me for a month and setting up an entirely different procedure without consulting anyone before a different doctor tells me that I needed something different the whole time.","What causes me the most anxiety or worry when visiting the doctor's office is the concern that they are not being attentive or thorough enough with my health care. It makes me anxious that there may be an underlying issue or need for a more intensive examination, but my concerns might be disregarded or overlooked due to their overbooked schedules. I am always worried that I may not receive the level of care necessary for my health needs.","Money. I have no insurance so if there's something serious and I have to be rushed to the hospital, I will never be able to pay for it. I would rather they just leave me on the examination table to die than help at that point. I'm already in debt because of college loans; I literally can't afford to be in any more debt than I already am.","Let me share with you a recent episode which incidentally showcased my knowledge about health issues. My close friend started experiencing frequent headaches along with a constant feeling of fatigue. Instead of ignoring her symptoms or suggesting her to take rest, I advised her to get a proper medical check-up. I suspected it could be Anaemia, as it is common amongst women and often characterized by similar symptoms. When she did get herself checked, it turned out my suspicion was right. This episode reminded me about the importance of","My mother was recently treated for breast cancer and just had her third of four chemotherapy sessions. She was initially told that she would not need chemo at all and would just have to do radiation to lower the rate of recurrence after the tumor and a lymph node was removed, and then a month later she had to very quickly reschedule, messing up work and therefore putting her insurance at risk. All of the complaints I've given you so far are incredibly fresh in my mind.","I suppose my feelings of distrust arise from past experiences where the general practitioners didn't seem to treat the urgency of the situation appropriately. The care extended to me sometimes lacked empathy or understanding. However, I don't really think it's fair to let a few negative experiences dictate my opinion of doctors in general. There are also those who have been professional, attentive and kind. But overall, I guess I find it difficult to trust something as vital as my health to someone who may not take it as seriously","So the surgery went incredibly well with only one nurse having poor bedside manner. The issue was the follow-up procedures. Radiation was all set up and ready to go before a sudden visit to the oncologist was scheduled. And we were informed that we were a month behind schedule. After that, suddenly radiation had to be pushed back over two months so four sessions of chemo could be forced through. We don't go to the first surgeon/general practitioner anymore. Apparently that's common with most surgeons: once they're done with you, you yourself don't need help anymore, even if you clearly do."
23,holdout_Text_Numeracy.jsonl,"I believe I have a good capacity to obtain, process, and understand basic health information and services. I have a college degree, after all. It's just that the burden of these decisions, their cost, and the uncertainty of outcomes weigh heavily on me. And, as I've learned, sometimes the information given to you is not always the most accurate or beneficial. So, while I can comprehend and make decisions, it's not always clear if they are the best or most appropriate ones.","I have the capacity to obtain, process, and understand basic health information. The problem is whether I am informed enough to make appropriate health decisions regardless of how many questions I ask. If I need to know something it should be TOLD to me, and if I need a procedure immediately it should be scheduled immediately instead of them ignoring me for a month and setting up an entirely different procedure without consulting anyone before a different doctor tells me that I needed something different the whole time.","What makes me most anxious is the uncertainty. I get worried about potential hidden issues that I might not even be aware of. The thought of walking in being seemingly healthy and walking out with a diagnosis is quite nerve-wracking at times. In addition to that, the clinical environment itself and the cold, impersonal nature of some doctors can amplify my anxiety.","Money. I have no insurance so if there's something serious and I have to be rushed to the hospital, I will never be able to pay for it. I would rather they just leave me on the examination table to die than help at that point. I'm already in debt because of college loans; I literally can't afford to be in any more debt than I already am.","I had intense abdominal pain that had gradually gotten worse over the course of six months. Initially, I attributed it to my menstrual cycle, but when it persisted, I knew something was off. Despite lacking a medical background, I started researching and speculated it could be gallstones. After I voiced this suspicion with my doctor, he ordered an ultrasound. Sure enough, gallstones were found in my gallbladder. Even though I'm not a health aficionado, this experience showed me the importance of being","My mother was recently treated for breast cancer and just had her third of four chemotherapy sessions. She was initially told that she would not need chemo at all and would just have to do radiation to lower the rate of recurrence after the tumor and a lymph node was removed, and then a month later she had to very quickly reschedule, messing up work and therefore putting her insurance at risk. All of the complaints I've given you so far are incredibly fresh in my mind.","It's more of a mistrust towards the system than the individual doctors. I believe that most of them are doing their best with the information and resources they have, but the healthcare system as a whole often feels indifferent to me. There is a certain degree of time constraint, impersonality, and lack of transparency that makes me nervous. That, combined with the money factor - knowing that my ability to pay heavily influences the care I can get - adds a level of distrust.","So the surgery went incredibly well with only one nurse having poor bedside manner. The issue was the follow-up procedures. Radiation was all set up and ready to go before a sudden visit to the oncologist was scheduled. And we were informed that we were a month behind schedule. After that, suddenly radiation had to be pushed back over two months so four sessions of chemo could be forced through. We don't go to the first surgeon/general practitioner anymore. Apparently that's common with most surgeons: once they're done with you, you yourself don't need help anymore, even if you clearly do."
23,holdout_Text_SubjectiveLit.jsonl,"Given my mother's journey through her breast cancer treatment, I feel that I've gained a wealth of knowledge regarding the healthcare system and various treatments. I believe I can research, understand, and process health information reasonably well. However, my financial situation often inhibits my ability to make appropriate health decisions, as I'm always weighing potential medical needs against the financial burdens they could create.","I have the capacity to obtain, process, and understand basic health information. The problem is whether I am informed enough to make appropriate health decisions regardless of how many questions I ask. If I need to know something it should be TOLD to me, and if I need a procedure immediately it should be scheduled immediately instead of them ignoring me for a month and setting up an entirely different procedure without consulting anyone before a different doctor tells me that I needed something different the whole time.","I often worry about hearing a diagnosis of a serious ailment or disease. Even though I'm not overly proactive about my health, I fret about the possibility of having something wrong and not knowing about it. Additionally, the financial burden of any treatment or procedures is a constant source of anxiety for me, considering my income. I also find myself worrying about whether or not the doctor truly understands or listens to my health concerns.","Money. I have no insurance so if there's something serious and I have to be rushed to the hospital, I will never be able to pay for it. I would rather they just leave me on the examination table to die than help at that point. I'm already in debt because of college loans; I literally can't afford to be in any more debt than I already am.","After college, I worked as a medical scribe in a primary care office. That experience expanded my working knowledge of common illnesses and diseases far beyond what I had learned in my basic health classes in college. I was working closely with the doctors and seeing first-hand how they diagnose and treat illnesses. I saw everything from common colds to more chronic conditions like diabetes and heart disease. It was an eye-opening experience, and it has definitely influenced how I view health and medical issues.","My mother was recently treated for breast cancer and just had her third of four chemotherapy sessions. She was initially told that she would not need chemo at all and would just have to do radiation to lower the rate of recurrence after the tumor and a lymph node was removed, and then a month later she had to very quickly reschedule, messing up work and therefore putting her insurance at risk. All of the complaints I've given you so far are incredibly fresh in my mind.","I guess I feel a little uncertain with doctors in general. While they're human and everyone makes mistakes, a mistake from them could potentially be life-threatening which is scary. Some seem to care more about what the insurance will cover than what's effectively the best treatment. So, my trust somewhat wavers depending on the situation. However, I appreciate when they take the time to explain everything and genuinely seem to care about my health.","So the surgery went incredibly well with only one nurse having poor bedside manner. The issue was the follow-up procedures. Radiation was all set up and ready to go before a sudden visit to the oncologist was scheduled. And we were informed that we were a month behind schedule. After that, suddenly radiation had to be pushed back over two months so four sessions of chemo could be forced through. We don't go to the first surgeon/general practitioner anymore. Apparently that's common with most surgeons: once they're done with you, you yourself don't need help anymore, even if you clearly do."
23,holdout_Text_TrustPhys.jsonl,"While I am confident in my ability to grasp basic health information and services, my primary concern lies in whether I am being given the right information to make the best decisions for my health. Sometimes it feels like I need to be the one proactively asking and seeking out information rather than being properly informed by health professionals. And though I understand the mechanics of making sound health decisions, it's often not my top priority, which can feel like a barrier to adequate health decision-making.","I have the capacity to obtain, process, and understand basic health information. The problem is whether I am informed enough to make appropriate health decisions regardless of how many questions I ask. If I need to know something it should be TOLD to me, and if I need a procedure immediately it should be scheduled immediately instead of them ignoring me for a month and setting up an entirely different procedure without consulting anyone before a different doctor tells me that I needed something different the whole time.","What worries me the most about visiting the doctor's office is the potential for getting bad news, the uncertainty of not knowing what's wrong until the doctor tells me. The lab tests, the waiting, the unknown, all fuel my anxiety. Plus, the cost of healthcare, given my low annual income, is always a great concern. I often fear not being able to afford necessary treatments.","Money. I have no insurance so if there's something serious and I have to be rushed to the hospital, I will never be able to pay for it. I would rather they just leave me on the examination table to die than help at that point. I'm already in debt because of college loans; I literally can't afford to be in any more debt than I already am.","A few years back, I worked at a nursing home while I was finishing up college. The experience gave me a first-hand look at a variety of health issues and how they were managed. I learned a lot about the importance of medication, critical signs to watch for, and the general upkeep of seniors' health. Even though I wasn't the primary caregiver, I made it a point to understand residents' needs and habits. Looking back, I believe this experience really improved my knowledge around health matters.","My mother was recently treated for breast cancer and just had her third of four chemotherapy sessions. She was initially told that she would not need chemo at all and would just have to do radiation to lower the rate of recurrence after the tumor and a lymph node was removed, and then a month later she had to very quickly reschedule, messing up work and therefore putting her insurance at risk. All of the complaints I've given you so far are incredibly fresh in my mind.","As for doctors in general, my level of trust is quite low. They seem more concerned about getting paid for a bunch of tests rather than actually treating people. I mean, I've seen patients who have been in for multiple visits, various tests, consultations with numerous specialists, and they’re still clueless about what's wrong with them. I believe doctors mean well, but I consider the quality of healthcare as being on a downhill slope.","So the surgery went incredibly well with only one nurse having poor bedside manner. The issue was the follow-up procedures. Radiation was all set up and ready to go before a sudden visit to the oncologist was scheduled. And we were informed that we were a month behind schedule. After that, suddenly radiation had to be pushed back over two months so four sessions of chemo could be forced through. We don't go to the first surgeon/general practitioner anymore. Apparently that's common with most surgeons: once they're done with you, you yourself don't need help anymore, even if you clearly do."
