Sample Index,Condition,Text_SubjectiveLit Generated,Text_SubjectiveLit True,Text_Anxiety Generated,Text_Anxiety True,Text_Numeracy Generated,Text_Numeracy True,Text_TrustPhys Generated,Text_TrustPhys True
7,conditioning_on_all.jsonl,"I definitely feel I have a decent capacity to obtain, process, and understand basic health information and services to make appropriate health decisions. As much as I prioritize other aspects of life, I strive to understand health-related concerns. Sometimes the professional jargon can be a hurdle, but I find the quicker I overcome that, the easier it is to stay healthy. With the help of my doctors or advice obtained from reliable sources, I believe I could make informed health decisions when necessary. However, I do realize",i am not that old for me not to understand what the doctors trying to say. i am having trouble to read their writings but pharmacy can do it for me. so i am certain that i can get what i needed,"Although I understand the importance of regular check-ups and preventive healthcare, it's the uncertainty that gets to me. I fear the possibility of an unexpected diagnosis, especially those linked to genetic or hereditary conditions I may not be able to prevent. I also get a little bit nervous about the procedures and tests, not knowing the results instantly can be anxiety-inducing.",when they are talking about serious health problem. a words from him that might lead to a bad health issue. testing my blood for std and other lifetime problems,"A couple of years ago, I decided it was time to make a significant change to my diet. I evaluated my eating habits and realized I was leaning on fast food for quick meals far too often. I started educating myself about nutrition, reading up on different types of diets, what foods to incorporate, and how to maintain balanced nutrition. It was a bit daunting at first, but I gradually made changes. I started cooking more at home, focusing on whole foods and reducing processed ones. I also tried",i work as a nurse before. they teach us how to takes care of a patient and first aid. i didn't finish it but i have knowledge about it.,"I have a certain level of trust in my primary care physician. Given my belief that personal health largely depends on one's own actions, I see him more as a guide rather than the final answer to my health issues. He's undergone years of training and education which gives me confidence. However, our meetings sometimes feel rushed and not all my concerns are addressed adequately, which leaves me feeling a bit unsettled. So overall, my trust is not absolute, but he does hold an important role in my","our doctor is well known in my community and he is our family doctor. my mom trust him, so i trust him too. but talking to other doctors, i test them first by asking a lot of questions before i can trust them"
7,holdout_Text_Anxiety.jsonl,"I feel like I do have the capacity to understand and process basic health information. I know the importance of eating right and exercising, although I admittedly don't always prioritize it as much as I should. I believe that it mostly depends on how well you take care of your body and I make an effort, though not always as consistently as I should. I can navigate the healthcare system pretty efficiently and usually comprehend what my doctors are saying. However, I'm not a medical professional, so there's always",i am not that old for me not to understand what the doctors trying to say. i am having trouble to read their writings but pharmacy can do it for me. so i am certain that i can get what i needed,i am worried about waiting. i don't want to wait for long. i don't like to be there but sometimes i need to be there for check up.,when they are talking about serious health problem. a words from him that might lead to a bad health issue. testing my blood for std and other lifetime problems,"I once had a work-related injury where I twisted my ankle pretty badly. Luckily, I knew that I needed to immediately put some ice on it and keep it elevated to prevent swelling and further damage. After a couple of days, when it didn't improve, I knew it was time to see the doctor. Turns out it was a severe sprain. My knowledge about how to respond to a sprain came in handy during that time.",i work as a nurse before. they teach us how to takes care of a patient and first aid. i didn't finish it but i have knowledge about it.,"I typically tend to trust my primary care physician because he has provided care for my family for a long time and has seen us through some tough times. He's built a relationship with us beyond just being our doctor; he truly seems to care about our wellbeing. But generally, with other doctors, my trust isn't automatic. I measure it based on their ability to communicate effectively, their level of empathy, as well as their professionalism. If they demonstrate these qualities, then my trust in them grows.","our doctor is well known in my community and he is our family doctor. my mom trust him, so i trust him too. but talking to other doctors, i test them first by asking a lot of questions before i can trust them"
7,holdout_Text_Numeracy.jsonl,"I'd like to believe that I possess a reasonable capacity to obtain and understand basic health information. I'm open to learning, and always try at the doctor's office to ask questions when needed. Even though medical language can be complex, I always find a way to understand what I need to know about my health. However, it definitely requires a bit of research at times and understanding the intricate details can sometimes pose a challenge.",i am not that old for me not to understand what the doctors trying to say. i am having trouble to read their writings but pharmacy can do it for me. so i am certain that i can get what i needed,"The most anxiety-inducing part of visiting the doctor's office for me is the anticipation. Waiting for test results or for the doctor to disclose any potential health issues is stressful. I also worry about possibly needing any major treatments or surgeries that could disrupt my daily life. And of course, there's the anxiety around anything related to pain or discomfort.",when they are talking about serious health problem. a words from him that might lead to a bad health issue. testing my blood for std and other lifetime problems,"I remember when my buddy was having a bad cough for weeks and he just kept taking cough syrup. I used to work construction with him and saw it wasn't getting any better. Since I know a little about health, I convinced him to see a doctor and it turned out he had serious bronchitis. If he'd just kept ignoring it, it could have turned into pneumonia. He thanks me till this day for pushing him to go see a doctor. I guess that counts for something.",i work as a nurse before. they teach us how to takes care of a patient and first aid. i didn't finish it but i have knowledge about it.,"Trust is something that really takes time for me to establish with doctors. I've had the same doctor since I was a teenager, and he's seen me through some tough times. What's kept me loyal is how he takes the time to explain things to me, rather than brushing off my concerns or rushing through appointments. He's considerate, listens, and usually gives me options rather than a single course of action. As for other doctors, it's much the same. If they show a genuine","our doctor is well known in my community and he is our family doctor. my mom trust him, so i trust him too. but talking to other doctors, i test them first by asking a lot of questions before i can trust them"
7,holdout_Text_SubjectiveLit.jsonl,"I feel comfortable with my ability to understand basic health information. In my job, I have to stay informed about certain health and safety procedures, and I'm often responsible for making decisions based off that information. If there's something I don't understand, I'm not afraid to ask questions or do some research on my own to get the answers I need. I wouldn't say I'm an expert, but I certainly have the capacity to understand the basic information necessary to make health decisions.",i am not that old for me not to understand what the doctors trying to say. i am having trouble to read their writings but pharmacy can do it for me. so i am certain that i can get what i needed,"There's always that bit of worry for me when I have to wait for test results - anything that could imply a serious health problem just makes me anxious. Despite trying to stay positive, the fear of being diagnosed with a life-threatening illness is always at the back of my mind. It's also the sterile, clinical setting and the way medical terms are thrown around that make me uncomfortable. I suppose it's the fear of the unknown, not knowing what the doctor might find.",when they are talking about serious health problem. a words from him that might lead to a bad health issue. testing my blood for std and other lifetime problems,"A few years ago, a friend of mine had a severe bout of food poisoning. Because of my education and background, I recognized his symptoms and I knew it was critical to keep him hydrated. I also knew that it wasn't just a simple stomach bug so I convinced him to go to the hospital, and it's a good thing we did because he ended up needing treatment. Had we waited any longer, he could have had serious complications. My knowledge of health issues helped save my friend from a",i work as a nurse before. they teach us how to takes care of a patient and first aid. i didn't finish it but i have knowledge about it.,"Like I mentioned before, my primary care doctor is a pillar of my community and has taken care of my family for years. My trust in him is based off of my family's experience and the years of history we have with him. In terms of other doctors, I approach them with cautious optimism. I realize that they've undergone serious training, but I also know that they're humans who can make mistakes. Once they prove themselves knowledgeable and indeed have my best interest at their heart, I am able","our doctor is well known in my community and he is our family doctor. my mom trust him, so i trust him too. but talking to other doctors, i test them first by asking a lot of questions before i can trust them"
7,holdout_Text_TrustPhys.jsonl,"I believe I have a decent capacity to understand health information and make appropriate decisions in that regard. While I don't have a professional medical background, my prior knowledge and common sense help guide me in making informed health choices. I take the time to do some independent research in terms of nutrition, exercise, and disease prevention, although it's not my main focus. I feel confident translating a doctor's advice into action and when I find something difficult to understand, I don't hesitate to ask for clarification.",i am not that old for me not to understand what the doctors trying to say. i am having trouble to read their writings but pharmacy can do it for me. so i am certain that i can get what i needed,"While I prefer not to consider it too often, I get anxious about the possibility of receiving bad news regarding serious illnesses - something that could disrupt my life significantly. Also, that concerned look on a doctor's face after a check-up or tests can make me quite uneasy. I guess the uncertainty and the waiting for results can be quite nerve-wracking for me, more than the actual visit.",when they are talking about serious health problem. a words from him that might lead to a bad health issue. testing my blood for std and other lifetime problems,"A few years back, I experienced this persistent cough that wouldn't go away. I did some research online and realized that my symptoms were pointing towards bronchitis. I went to the doctor with this information. After examination, the doctor confirmed that I indeed had bronchitis. I was really glad that I had the knowledge to distinguish my symptoms and this indeed helped me in seeking medical help on time.",i work as a nurse before. they teach us how to takes care of a patient and first aid. i didn't finish it but i have knowledge about it.,"i've been with my doctor for more than a decade now, and during that time, he's always provided adequate care and beneficial advice. His efficiency in diagnosing any health problems I've had and candidly explaining the solutions makes me trust him. His willingness to listen to my concerns and answer any questions I have makes me feel like my health is in capable hands. However, I may question things sometimes, as I know that physicians are also humans who can make mistakes occasionally.","our doctor is well known in my community and he is our family doctor. my mom trust him, so i trust him too. but talking to other doctors, i test them first by asking a lot of questions before i can trust them"
7,Baseline Zero Shot,"I believe I have a high capacity to obtain, process, and understand basic health information and the services needed to make appropriate health decisions. I am a proactive individual who has good literacy skills. I research my health concerns, understand the basics, and try to keep myself updated about medical advancements. I also ensure to clarify any ambiguity I have with my health care providers. I am comfortable with technology and can make effective use of online resources, which is significant in today's digital world. Nevertheless, I always",i am not that old for me not to understand what the doctors trying to say. i am having trouble to read their writings but pharmacy can do it for me. so i am certain that i can get what i needed,"One of my primary sources of anxiety when visiting the doctor's office is the anticipation of receiving potentially unfavorable results from tests or diagnoses. Even routine check-ups can create a heightened sense of worry regarding unknown health issues. Additionally, the sterile, clinical environment and the procedural nature of these visits can be somewhat unnerving. Waiting for my turn in the waiting room, surrounded by others who might be sick, also contributes to my anxiety.",when they are talking about serious health problem. a words from him that might lead to a bad health issue. testing my blood for std and other lifetime problems,"A few years ago, my father was diagnosed with Type 2 diabetes. Since no one in our family had a history of this condition, I decided to proactively learn about it to support him. I researched extensively about the disease, its symptoms, dietary restrictions, exercise, and treatment options. With my persistent efforts, not only was I able to assist my father in controlling his diet, exercise, and medications, but I also played a crucial role in spreading awareness about this condition among our relatives.",i work as a nurse before. they teach us how to takes care of a patient and first aid. i didn't finish it but i have knowledge about it.,"I generally trust my primary care physician because of the rapport we have established over the years. He has helped me successfully navigate through various health challenges which has made me have faith in his professional skills and judgment. He tends to listen to my concerns attentively and explains my conditions or the treatment plan in a way that I can understand. This has created a level of comfort and confidence. However, there are times when I feel he is somewhat rushed, possibly due to the number of patients he has to attend","our doctor is well known in my community and he is our family doctor. my mom trust him, so i trust him too. but talking to other doctors, i test them first by asking a lot of questions before i can trust them"
7,no_system_prompt.jsonl,"I feel quite confident about my capacity to obtain, process, and understand basic health information. Having worked as a nurse prior, albeit for a brief period, I have some medical background and knowledge. I tend to ask questions when I don't understand something and do my own research too. Overall, I think I'm competent enough to make appropriate health decisions.",i am not that old for me not to understand what the doctors trying to say. i am having trouble to read their writings but pharmacy can do it for me. so i am certain that i can get what i needed,"I think what makes me most anxious is the fear of uncertainty, not knowing what the doctor might find or say. There's also the worry about potential pain or discomfort during exams or tests. I also feel anxious about the possibility of receiving bad news regarding my health.",when they are talking about serious health problem. a words from him that might lead to a bad health issue. testing my blood for std and other lifetime problems,"A couple of years ago, my father had a minor heart attack and had to be treated urgently. With my prior knowledge from working as a nurse, I was able to recognize his symptoms early as a serious issue and I contacted emergency immediately. This incident helped me realize the importance of health awareness and reinforced my knowledge about cardiac disorders.",i work as a nurse before. they teach us how to takes care of a patient and first aid. i didn't finish it but i have knowledge about it.,"I trust my primary care physician, primarily because they have a good track record. They've been able to accurately diagnose and treat any ailments I've had in the past. Plus, they always take time to explain things thoroughly and answer any questions I have, which makes me feel at ease. However, when it comes to doctors in general, I would say my trust would depend on my personal interaction with them and their professionalism. Every doctor is different, so it really does vary.","our doctor is well known in my community and he is our family doctor. my mom trust him, so i trust him too. but talking to other doctors, i test them first by asking a lot of questions before i can trust them"
8,all_4.jsonl,"I believe I have a good degree of capacity to obtain and understand basic health information and services. I might not comprehend every advanced medical terminology, but overall, I'm able to take information provided by my caregivers and use it responsibly to maintain my health. If there's something I don't understand, I'm not afraid to ask questions until I do.","All health information should be presented to me and if I am confused about something, I should be able to ask question and given reasonable answers. ","What makes me feel most anxious is the unknown. The waiting for test results, the fear of being diagnosed with some unforeseen ailment, or picking up some sort of infection at the office. The environment itself can also be quite intimidating, the sterile smells, and the sight of medical instruments.",I fear that they will find something life threatening to me or my child. Or that I failed one of my blood test ,"One time, I started experiencing chest pains and difficulty breathing. Instead of panicking, I recognized these as symptoms of anxiety from things I've read and learned. I did some breathing exercises and was able to calm myself down. I then went to seek professional help, just to ensure it wasn't something more serious. The doctor confirmed it was anxiety and helped me set up a plan to manage it better. ",I was tested for my iron level while pregnant and it came back 10.7. Pregnant women iron level is suppose to be at a 12,"I generally trust doctors, but I am also aware that they can make mistakes just like anyone else. It's important to me that they take the time to explain their diagnosis and treatment plan in a way that I can understand. If a doctor tends to rush through appointments or doesn't seem to listen to my concerns, it lowers my trust in them because it feels like they don't value my input or understand my concerns.",I trust my OBGYN caregiver because she is always honest and answers any of my questions with not only her professional opinion but based on her experience 
8,conditioning_on_all.jsonl,"I feel like I have a pretty good capacity to obtain, process, and understand basic health information and services. I mean, I might not be a medical expert or anything, but I'm definitely able to learn and understand the main ideas when it comes to staying healthy. I do my own research, ask a lot of questions, and I also take the advice of professionals seriously. There are some complex health topics that could probably be hard to grasp, but for the most part, I feel confident in","All health information should be presented to me and if I am confused about something, I should be able to ask question and given reasonable answers. ","Honestly, the unknown is what hits me hardest when heading to the doctor's office. Being unsure about what they might find or say can be really unsettling. Plus, there's just something about that sterile, medical atmosphere that always puts me on edge. Then, there's the financial part—will I be able to afford the services, tests or medications they might suggest? Daughter of a single mom with a tight budget and no luxuries, every penny counts, you know. It's a feeling of",I fear that they will find something life threatening to me or my child. Or that I failed one of my blood test ,"There was a period a few years ago when I started gaining weight and I was genuinely concerned about it, so I decided to learn more about how to eat and exercise properly. I enrolled in an online course about nutrition and started researching ways to do workouts at home. I learnt so much about the impact of diet on our health and how physical activities not only help with weight management but also boost our mood and overall well-being. It wasn't easy to make changes and stick to them, but the effort",I was tested for my iron level while pregnant and it came back 10.7. Pregnant women iron level is suppose to be at a 12,"Well, I can't say I completely trust or distrust my primary care physician. You see, for me, it all comes down to personal care and attention. Sometimes, I feel doctors are just trying to rush the next patient in, without giving the time and attention I believe each patient deserves. I mean, we're talking about our health here, you know? However, I don't totally distrust them because I realize they have the medical training and knowledge that I don't. That's why I",I trust my OBGYN caregiver because she is always honest and answers any of my questions with not only her professional opinion but based on her experience 
8,holdout_Text_Anxiety.jsonl,"I believe I have a fair capacity to obtain, process, and understand basic health information and services needed to make appropriate decisions for my health. While my knowledge isn't vast, I am willing to learn and actively seek out understanding when I need it. Whether through researching or asking directly from healthcare professionals, I try to take charge of my health to the best of my ability.","All health information should be presented to me and if I am confused about something, I should be able to ask question and given reasonable answers. ","The thing that makes me most anxious when visiting the doctor's office is the fear of the unknown. I worry about receiving a bad diagnosis or finding out about a health issue that I wasn't aware of. It's stressful not knowing what the doctor might find during a check-up, even if you feel completely fine.",I fear that they will find something life threatening to me or my child. Or that I failed one of my blood test ,"A few years ago, I started experiencing severe fatigue and dizziness at random times during the day. I decided to go for a check-up and told my doctor about my symptoms. Based on my experience caring for my anemic grandmother, I suspected that I might be anemic as well. My doctor ordered a blood test and I was indeed diagnosed with iron deficiency anemia. I was relieved to have identified the problem and I was able to manage my condition through diet adjustment and iron supplements.",I was tested for my iron level while pregnant and it came back 10.7. Pregnant women iron level is suppose to be at a 12,"I trust doctors in general because I believe they have studied and trained to understand health issues better than most people. They have the experience and expertise that I lack when it comes to understanding medical situations. However, I can't blindly trust them, I still do my own research and ask questions since, in the end, it's about my body and health. Sometimes, I feel like they're too quick to prescribe medications without discussing other lifestyle changes first, and that makes me a bit wary. It's",I trust my OBGYN caregiver because she is always honest and answers any of my questions with not only her professional opinion but based on her experience 
