Sample Index,Condition,Text_SubjectiveLit Generated,Text_SubjectiveLit True,Text_Anxiety Generated,Text_Anxiety True,Text_Numeracy Generated,Text_Numeracy True,Text_TrustPhys Generated,Text_TrustPhys True
14,no_system_prompt.jsonl,"I believe that I have a strong capacity to obtain, process, and understand basic health information. I actively seek out knowledge, both through discussions with healthcare providers and through independent research. I understand that making informed healthcare decisions involves taking into consideration different aspects, such as potential side effects and benefits of treatments, lifestyle changes, and costs. I am proactive in asking my physician questions until I am fully satisfied that I understand my options.","I try to be as open and honest with my health care provider as I can. When I visit the health care provider I accept the fact that in the end they are the expert in the field. I may have some limited knowledge and will give what little I know and ask questions based on that. However, I look to them as the person who can best understand and explain things. It is their field of expertise and seek them for their knowledge and help.","My main source of anxiety during doctor visits typically comes from the fear of the unknown. Not knowing what the doctor might find or tell me can be unsettling. Medical tests and procedures can also seem daunting, sometimes more due to the fear of potential results than the process itself. I also worry about receiving news that would require significant changes to my lifestyle.",That the doctor will detect something that could be life threatening at the least. Even if it not life threatening if I was told that I would have to radically alter my life style such as activities or diet I would find it as a great disruption. At least at first.,"In my early 40s, I started experiencing frequent heartburn and digestive issues. Based on my research on the topic and my symptoms, I suspected that it might be due to acid reflux disease. I consulted my doctor with these symptoms and my suspicion. The doctor ordered a few tests and my diagnosis was confirmed. I felt that my understanding of health symptoms from thorough reading helped me to approach the doctor with accurate information, which led to quicker diagnosis and treatment. It also made me realize the importance of",When I first made my initial visit to my doctor I came prepared with several questions. I was pleased that she did not just talk about what medicines I may have to take but asked about my diet and exercise routine. She was rather pleased that I already had an established exercise program and watched the intake of sodium in my diet and encouraged me to continue on the path I was on.,"I trust my primary care physician due to our open and respectful line of communication. He takes the time to explain diagnoses and treatment options in a clear and patient-friendly language, listens to my concerns, and respects my inputs about my own body. However, sometimes I feel that due to time constraints, our appointments can feel a bit too rushed and I fear certain issues may be overlooked. But overall, his medical knowledge, patient-centric approach and ability to convey complex concepts build my trust.","My doctor is very open and honest. She just not speak down to me or just give me orders. She communicates with me in a dialogue, listening to my concerns and opinions. She shows real interest, offers advice, and listens. She does not lecture but works with me as a teammate to take care of my health."
15,all_4.jsonl,"I believe I have a good capacity to obtain, process, and understand basic health information. Since health is something I moderately prioritize, I invest time into learning about different ways to improve well-being. I read articles, research studies, and usually have productive conversations with my doctor about any concerns or questions. However, while I do make efforts, I wouldn't say I'm always proactive or that I go the extra mile every time. There are areas I could do better in, especially in terms of disease",I have a lot of knowledge on how to read it because i research it. I have people in my family that are nurses.,"What makes me anxious when visiting the doctor are the possibilities of receiving bad news about my health. Besides that, the atmosphere of a clinic or a hospital also makes me feel stressed. Existence of a new health problem or the fear of current ones getting worse also worries me.",The time i have to wait to see him. The amount of medicine i have to take.  If the doctor disappointment in me.,"I remember a few years back when my grandmother fell ill due to high blood pressure. I was able to identify her symptoms early because of my interest and basic knowledge about health topics. I knew that her continuous headaches and dizziness were not normal, so I suggested she visit the doctor. It turned out her blood pressure was alarmingly high, and she was able to get the necessary treatment in time. My understanding of this health issue quite possibly saved her life.",I have medical issues is that movement disorder . i have to take four medicine. I could not sleep well at all.,"I trust my primary care physician because I feel that she understands my concerns and doesn't trivialize them. She thoroughly explains my health conditions and the benefits and potential side effects of any proposed treatments. I can see she's competent, knowledgeable, and willing to answer my questions transparently which builds the trust in our relationship. However, I do worry sometimes about the time constraints during appointments, the fact that I have to rush through my questions can be disconcerting.",I trust my physician because he cares about me. He always gives me good advice. He doesn't give me medicine that i don't need.
15,conditioning_on_all.jsonl,"I believe I have a fairly good capacity to obtain, process and understand basic health information and services. I am educated and can comprehend health-related concepts easily. I also make conscious efforts to stay informed about new health and wellness guidelines and advances. However, I can't say I always prioritize putting this knowledge into action as effectively as I would like. I make some strides towards disease prevention and maintaining a healthy lifestyle, though it's not always my top priority. So, while I feel very confident in my",I have a lot of knowledge on how to read it because i research it. I have people in my family that are nurses.,"Honestly, going to the doctor just generally makes me nervous. I guess it's the uncertainty that's particularly bothersome. I mean, what if they find something wrong that I wasn't aware of? That possibility really looms in the back of my mind. Plus, sometimes the whole environment can be overwhelming. You know, the clinical smell, the sterile environment, even filling out extensive medical forms... it all can be quite stressful.",The time i have to wait to see him. The amount of medicine i have to take.  If the doctor disappointment in me.,"A couple of years ago, I noticed that I started gaining weight despite having a moderately active lifestyle. After doing some research, I decided to revamp my diet, started adding more fruits, vegetables, and lean proteins, and reduced my intake of processed foods. I also began to incorporate more physical activities into my daily routine, like walking and yoga. Within a few months, I started seeing significant improvements not just in my weight, but also in my overall health. This experience taught me that achieving good",I have medical issues is that movement disorder . i have to take four medicine. I could not sleep well at all.,"I am neutral about my trust in my primary care physician. I feel that they are knowledgeable and have the proper training to make informed decisions regarding my health. However, my trust wavers when I'm unsure if they're treating me as a unique individual or just another patient. At times, I feel they don't fully listen or understand my health concerns, which can frustrate me. I value doctors who can go beyond the clinical approach and consider my specific circumstances and lifestyle, and sometimes I don't",I trust my physician because he cares about me. He always gives me good advice. He doesn't give me medicine that i don't need.
15,holdout_Text_Anxiety.jsonl,"I believe I have a good capacity to obtain, process, and understand health information. My college education has equipped me with the skills to research and understand complex information. Also, I’ve developed good habits of staying informed on health matters due to my belief in taking care of myself. However, I might not always prioritize seeking out this information unless particularly necessary.",I have a lot of knowledge on how to read it because i research it. I have people in my family that are nurses.,What makes me most anxious when visiting the doctor's office is not knowing what their diagnosis or the results of my tests may be. I sometimes fear they may find something serious. It's the uncertainty that gives me anxiety.,The time i have to wait to see him. The amount of medicine i have to take.  If the doctor disappointment in me.,"A few years ago, I had a personal encounter with prediabetes. My doctor initially brushed me off when I raised concerns about feeling overly fatigued. That's when I decided to take charge of my own health. I researched and educated myself extensively about the condition, dietary changes, and exercises that could reverse my prediabetic state. I was able to lower my blood sugar levels and prevent progressing to full-blown diabetes. I attribute this success to me taking the time to understand my health",I have medical issues is that movement disorder . i have to take four medicine. I could not sleep well at all.,"I have a strong trust in my primary care physician because she has demonstrated great knowledge and understanding in her field. She communicates effectively and takes time to explain things in an understandable way. She also seems really dedicated to her work, and this passion gives me confidence in her skills. The main reason I trust her, however, is due to the consistent quality of care she provides.",I trust my physician because he cares about me. He always gives me good advice. He doesn't give me medicine that i don't need.
15,holdout_Text_Numeracy.jsonl,"I believe I possess the capacity to understand and process basic health information, given my educational background and a strong interest in maintaining my own health. However, there's always room for growth and learning. I am aware I need to take steps towards prevention of illnesses regularly but it usually becomes more of an afterthought. I do make some efforts, but I understand I could put in more to live in the best possible health.",I have a lot of knowledge on how to read it because i research it. I have people in my family that are nurses.,"What makes me most anxious when visiting the doctor's office is the potential for bad news. Even with routine check-ups, I can't help but worry about them finding something unexpected. Waiting for results from tests can be very stressful, too. Additionally, I sometimes fear judgement when discussing lifestyle habits or personal issues.",The time i have to wait to see him. The amount of medicine i have to take.  If the doctor disappointment in me.,"A while back, my friend came down with a terrible flu-like symptoms. I knew from my habitual reading and a basic health class I took in college that these were symptoms of severe dehydration or possibly even food poisoning. I encouraged her to stay hydrated and go to the ER. Turned out, she had a severe case of food poisoning and required immediate medical attention. My understanding of health information may have saved her life.",I have medical issues is that movement disorder . i have to take four medicine. I could not sleep well at all.,"As a relatively health-conscious person, I generally trust my primary care physician. They have gone through extensive training, so I respect their knowledge and expertise. I also appreciate that they take the time to listen to my concerns, answer my questions and explain things clearly. But what I value most about them is being proactive about preventive care, which aligns with my belief in taking cared of oneself to maintain health. They often provide me useful advice on taking preventive measures to keep healthy. I have no significant reasons",I trust my physician because he cares about me. He always gives me good advice. He doesn't give me medicine that i don't need.
15,holdout_Text_SubjectiveLit.jsonl,"I feel quite confident in my ability to understand and process medical information. I'm an avid reader and enjoy watching educational shows, so I often seek out information on health issues. What's more, my college education equipped me with good general health knowledge. However, when faced with more complex medical jargon I sometimes struggle, but I'm not afraid to ask questions and seek clarification from healthcare professionals.",I have a lot of knowledge on how to read it because i research it. I have people in my family that are nurses.,"I often feel anxious about the potential for bad news. There's always that fear that the doctor might discover something serious about my health that I wasn't aware of. I'm also worried about the possible side effects of medications they might prescribe. Plus, having to be poked and prodded during physical exams can be somewhat nerve-wracking as well.",The time i have to wait to see him. The amount of medicine i have to take.  If the doctor disappointment in me.,"A few years ago, I developed a serious knee infection. Instead of ignoring it, I recognized the seriousness of the situation due to my basic understanding of health issues. I promptly sought medical attention and it was a good thing I did because the infection was quite severe and needed immediate treatment. My knowledge of health issues most likely saved me from a much worse outcome.",I have medical issues is that movement disorder . i have to take four medicine. I could not sleep well at all.,"I have trust in my primary care physician primarily because she always makes sure to explain everything to me in detail, from diagnosis to treatment plans. This gives me a sense of involvement in my own health and ensures I understand what my body is going through. However, there's always an underlying fear that she might miss or overlook something important because she has many other patients to attend to, which can be a little disconcerting. Ultimately, I understand that doctors are humans too, and can make mistakes,",I trust my physician because he cares about me. He always gives me good advice. He doesn't give me medicine that i don't need.
15,holdout_Text_TrustPhys.jsonl,"I feel very confident in my ability to understand and process essential health information. Over the years, I've had experiences that honed my skills in interpreting medical guidance or procedures. Although I am not a health expert, having a college education has enhanced my analytical and research skills. I know how to ask the right questions and seek information that aids me in making informed health decisions.",I have a lot of knowledge on how to read it because i research it. I have people in my family that are nurses.,"I always have anxiety surrounding the unknown. Not knowing what the doctor might find or say during the appointment has me on edge. Also, feeling like I might not understand all the medical jargon used, makes me nervous. While I try to stay informed about my health, there's always a bit of nervousness accompanying doctor's visits.",The time i have to wait to see him. The amount of medicine i have to take.  If the doctor disappointment in me.,"A few years ago, my grandmother was diagnosed with diabetes. I quickly took it upon myself to learn as much as I could about the condition, as well as how diet and exercise factors into managing it. That included understanding what foods are beneficial for maintaining stable blood sugar levels and what types of physical activities can help. I attended doctor's appointments with her to clarify information and ensure we were doing everything right. This experience deepened my understanding of both the condition and how everyday lifestyle choices can significantly affect health",I have medical issues is that movement disorder . i have to take four medicine. I could not sleep well at all.,"I trust my primary care physician mainly due to the individual attention she provides during our visits. She takes her time to listen to my concerns and ensures that I understand any treatment options or medical advice that she gives. That said, sometimes I get a bit skeptical when she seems too quick to prescribe medication for something that may be treated naturally. However, overall, her competence and willingness to engage with me on a personal level make me trust her.",I trust my physician because he cares about me. He always gives me good advice. He doesn't give me medicine that i don't need.
15,Baseline Zero Shot,"I feel confident in my ability to obtain, process, and understand basic health information and services. I am reasonably knowledgeable and proactive about my health and tend to research and educate myself on various health topics. I believe I have the necessary skills needed to make appropriate health decisions. But, nevertheless, there can be complex healthcare scenarios where I might require some professional guidance to understand the intricacies.",I have a lot of knowledge on how to read it because i research it. I have people in my family that are nurses.,"One of my main concerns is the fear of unknown or bad news about my health. I often worry that the doctor might discover a serious illness or condition that I was previously unaware of. The mere anticipation of such findings provokes severe anxiety. Additionally, I also get anxious about the possibility of undergoing painful procedures or tests. Uncertainty about the whole process, wait times, and interactions with medical professionals also contribute to my anxiety.",The time i have to wait to see him. The amount of medicine i have to take.  If the doctor disappointment in me.,"A few years ago, my mother was diagnosed with Type 2 Diabetes. This prompted me to gain a deeper understanding of the disease. I spent countless hours researching about Diabetes, its effects on the body, diet and lifestyle modifications, medication and insulin requirements. I also attended her medical appointments where I got to interact with healthcare professionals and learned more about her medical condition. This experience deepened my knowledge of health issues and gave me a firsthand view of what it takes to manage a chronic disease.",I have medical issues is that movement disorder . i have to take four medicine. I could not sleep well at all.,"I generally trust my primary care physician because of her professionalism and the rapport we've built over a period of time. She takes out time to listen attentively to what I'm feeling physically as well as emotionally before diagnosing my symptoms, which is important to me. However, I do have a degree of distrust due to past experiences where my conditions were misdiagnosed by other doctors. This is not specific to my current physician, rather a general skepticism towards medical practitioners due to past events.",I trust my physician because he cares about me. He always gives me good advice. He doesn't give me medicine that i don't need.
15,no_system_prompt.jsonl,"I believe I have a high degree of capacity to obtain, process, and understand basic health information. Due to my personal interest and experience with the healthcare system and having family members in the medical field, I have developed a good understanding of health information. I'm able to research health issues, understand medical jargon to a certain extent, and make decisions based on that understanding.",I have a lot of knowledge on how to read it because i research it. I have people in my family that are nurses.,"One of the things that makes me most anxious is the uncertainty. I worry about the potential of a serious diagnosis or the possibility that I may not get answers to my health concerns. I also feel anxious about procedures or examinations that may cause discomfort. Moreover, the sterile atmosphere of a doctor's office is a bit intimidating and adds to my anxiety.",The time i have to wait to see him. The amount of medicine i have to take.  If the doctor disappointment in me.,"A few years ago, I experienced an allergic reaction to an antibiotic I was prescribed. Because I had taken the time to understand the potential side effects and reactions of the medicine, I was able to identify the symptoms and promptly sought medical help. My knowledge helped me prevent the situation from getting worse.",I have medical issues is that movement disorder . i have to take four medicine. I could not sleep well at all.,"I trust my primary care physician because he always takes the time to explain everything to me in a way that I can understand. He understands my personal situation and listens to my concerns. He's always available when I have questions, and I feel that he truly cares about my well-being. His diagnosis and treatments have always been accurate and effective, which gives me confidence in his capabilities.",I trust my physician because he cares about me. He always gives me good advice. He doesn't give me medicine that i don't need.
16,all_4.jsonl,"I feel very confident in my ability to obtain, process, and understand basic health information and make the appropriate health decisions. I've always paid extra attention when it comes to health matters, and I often read and research preventive care methods as well as potential treatments for health issues. Although I don't have a formal education in the healthcare field, I feel that my personal experiences and my interest in maintaining my health have equipped me to be proactive and informed about my healthcare.",I am an accountant professionally but do feel that I am able to comprehend and make appropriate health decisions. I say this because I have either personally or helped someone deal with many health issues and feel I would be be able to getting any additional help I might need from the internet.,"I always experience an underlying sense of apprehension that there might be findings of an unexpected health issue. The whole process of waiting for tests and their results can be nerve-wracking. It's not so much the actual visit to the doctor's office that causes anxiety, but the potential consequences and uncertainties they might unearth regarding my health.",Just a very little that he will find something that might reveal a serious health problem I was previously unaware of. ,"A few years back, I managed to fully recover from a bout of high cholesterol without the need for medication. And this recovery was all down to my commitment to making lifestyle changes. I extensively researched about the condition, understood the importance of a balanced diet, rigorous exercise, and maintaining a healthy weight. With the help of support from family and consultation from my health advisor, I embarked on a health journey and successfully lowered my cholesterol levels within a year. This experience really demonstrated my understandings and ability to",I became caregiver for my developmentally disabled younger brother and became completely responsible for his medical care over 10 years ago. He has had several health issues over that time and I have been able to resolve most of those  issues.,"I have a great deal of trust in my primary care physician. This has built up over many years of positive experiences. He always takes the time to explain the situation, discuss various treatment options, and respects my input during these discussions. His approach ensures I feel involved with my care and this openness has strengthened my trust in him.",I have worked with for many years and found his advice to be very good and has helped be get over various health issues in a reasonable time by following it.
