Sample Index,Condition,Text_SubjectiveLit Generated,Text_SubjectiveLit True,Text_Anxiety Generated,Text_Anxiety True,Text_Numeracy Generated,Text_Numeracy True,Text_TrustPhys Generated,Text_TrustPhys True
22,Baseline Zero Shot,"I believe I have a good capacity to obtain, process, and understand basic health information. I am capable of researching, reading, and taking in medical materials, facts, and figures. Understanding health information comes relatively easy to me and I am confident in using this information to make informed decisions about my health. However, I do get overwhelmed sometimes when the information is quite complex. That's when I depend on health professionals to break it down for me in simpler terms.","I feel pretty confident in this capacity mainly because i deal with these situations often, so I'm kind of used to it. ","One of the things that intensifies my anxiety when visiting the doctor's office is the fear of the unknown. I often worry about the possibility of receiving unexpected bad news about my health. Waiting for test results, in particular, can be extremely nerve-racking. Additionally, the sterile, clinical environment can be quite intimidating and doesn't provide the most comforting atmosphere. The rushed demeanor of some doctors also sometimes adds to the anxiety, making the overall visit quite stressful.",I feel anxious or worried because i may not know what my problem is or if the doctor is pretty properly or just trying to get insurance money ,"A few years ago, my mother was diagnosed with Type 2 diabetes. Upon learning of her condition, I took it upon myself to gain as much knowledge as I could about the disease and how best to manage it through diet, exercise, and medication. I researched the various types of foods that she should be consuming and those she should avoid, figured out the types of exercise that would benefit her the most, and learned about the medication she was prescribed to understand its functions and potential side effects. It",I am aware that you have to exercise and eat right to be health. I know that eating lots of fried foods can causechigh cholesterol,"I trust my primary care physician mainly because of their professionalism and competence. They've consistently shown their knowledge and expertise in the field through effective diagnoses and treatments. Moreover, I appreciate their patience and approachability. They take the time to explain their findings and suggestions thoroughly, which bolsters my trust in their decisions. However, there are times when I feel they're slightly rushed or dismissive of minor concerns, which occasionally undermines my trust. Still, overall, I have confidence in their skills and judgments.",There are times when find that my doctor did treat or evaluate me properly. So i feel like i can't completely trust them . 
22,no_system_prompt.jsonl,"I believe I have a fairly good capacity to obtain, process, and understand basic health information. I'm proactive in researching and understanding my health conditions and the potential procedures involved. However, some medical terminologies or complex treatments can sometimes be confusing, so I try to ask the healthcare professional to explain further until I fully comprehend.","I feel pretty confident in this capacity mainly because i deal with these situations often, so I'm kind of used to it. ","What makes me most anxious at the doctor's office is the uncertainty and the fear of receiving bad news. I get worried about the possibility of being diagnosed with a serious illness. Moreover, the waiting time before the doctor sees me often adds to the anxiety.",I feel anxious or worried because i may not know what my problem is or if the doctor is pretty properly or just trying to get insurance money ,"A few years back, I got diagnosed with high cholesterol. Instead of solely relying on medication, I chose to educate myself about the condition. I started researching about diet, exercise and other lifestyle changes that could help me deal with the issue naturally. I learnt about foods rich in omega-3 fatty acids, lean proteins, soluble fiber etc, and started incorporating them into my meals. Alongside, I increased my physical activities and monitored my progress regularly. Such proactive participation in handling my health issues significantly improved",I am aware that you have to exercise and eat right to be health. I know that eating lots of fried foods can causechigh cholesterol,"I have a somewhat distrustful stance towards my primary care physician mainly because I have recently been misdiagnosed for some symptoms, which could have led to serious complications. Also, I often feel rushed during my appointments, which makes me feel undervalued as a patient. I miss the comprehensive and empathetic approach in their care. However, I do acknowledge their expertise and experience in the field, which is why I still consult them.",There are times when find that my doctor did treat or evaluate me properly. So i feel like i can't completely trust them . 
23,all_4.jsonl,"I have the capacity to obtain, process, and understand basic health information most of the time. However, actually making appropriate health decisions is a different matter entirely. I feel that even if you ask all the right questions and do all the research, there’s a lot that could go wrong in terms of miscommunication, misdiagnosis, or incorrect treatment. It feels overwhelming at times, almost as if you need a medical degree just to take care of your own health. So while I feel fairly confident","I have the capacity to obtain, process, and understand basic health information. The problem is whether I am informed enough to make appropriate health decisions regardless of how many questions I ask. If I need to know something it should be TOLD to me, and if I need a procedure immediately it should be scheduled immediately instead of them ignoring me for a month and setting up an entirely different procedure without consulting anyone before a different doctor tells me that I needed something different the whole time.","I think my primary concern is the fear of uncovering an unknown illness or a severe diagnosis. The process makes me anxious because I am apprehensive about what kind of news the doctor might give me. The uncertainty of waiting for test results can be pretty daunting. Moreover, I also worry about the financial implications as I do not have health insurance and medical treatments can be expensive.","Money. I have no insurance so if there's something serious and I have to be rushed to the hospital, I will never be able to pay for it. I would rather they just leave me on the examination table to die than help at that point. I'm already in debt because of college loans; I literally can't afford to be in any more debt than I already am.","A few years ago, my grandmother was diagnosed with Alzheimer's. Being the closest family member available, I had to step in and become her primary caregiver. I was only a college graduate with no medical background at that point, so the whole experience ended up being quite enlightening. From understanding the symptoms and progression of the disease, to learning about different therapeutic interventions, I learned a lot about the medical aspects of Alzheimer’s disease as well as the importance of holistic and compassionate care in such circumstances. Although","My mother was recently treated for breast cancer and just had her third of four chemotherapy sessions. She was initially told that she would not need chemo at all and would just have to do radiation to lower the rate of recurrence after the tumor and a lymph node was removed, and then a month later she had to very quickly reschedule, messing up work and therefore putting her insurance at risk. All of the complaints I've given you so far are incredibly fresh in my mind.","I have mixed feelings about doctors in general. On one hand, I value their knowledge and expertise, and I trust that they are typically doing their best to help me stay healthy. On the other hand, I also worry about the healthcare system they operate within, which often seems more focused on generating income than on providing patient care. Moreover, I had a recent experience where a doctor did not thoroughly explain a treatment plan for my mother, which left us feeling confused and anxious. So, in general,","So the surgery went incredibly well with only one nurse having poor bedside manner. The issue was the follow-up procedures. Radiation was all set up and ready to go before a sudden visit to the oncologist was scheduled. And we were informed that we were a month behind schedule. After that, suddenly radiation had to be pushed back over two months so four sessions of chemo could be forced through. We don't go to the first surgeon/general practitioner anymore. Apparently that's common with most surgeons: once they're done with you, you yourself don't need help anymore, even if you clearly do."
23,conditioning_on_all.jsonl,"I believe I have a capable degree of health information literacy. I completed my college education, which gives me the basic skills to obtain and understand health information. Also, my openness to experience allows me to easily process and adapt to new health information, although health is not my number one priority. However, because of my lower income level, it can be challenging to access certain health services or partake in healthier lifestyle changes that might be more costly.
","I have the capacity to obtain, process, and understand basic health information. The problem is whether I am informed enough to make appropriate health decisions regardless of how many questions I ask. If I need to know something it should be TOLD to me, and if I need a procedure immediately it should be scheduled immediately instead of them ignoring me for a month and setting up an entirely different procedure without consulting anyone before a different doctor tells me that I needed something different the whole time.","What makes me feel most anxious during a doctor's visit is the fear of hearing bad news about my health. Even though I don't prioritize preventive measures or believe that my self-care significantly influences my health, I still feel anxious about unexpected health issues. It's the uncertainty that scares and worries me the most. I'm also anxious about the possible financial implications; with an annual income of less than $20,000, significant health expenses can be quite intimidating.","Money. I have no insurance so if there's something serious and I have to be rushed to the hospital, I will never be able to pay for it. I would rather they just leave me on the examination table to die than help at that point. I'm already in debt because of college loans; I literally can't afford to be in any more debt than I already am.","Despite the fact that I don't prioritize my health, I recall a time when I had to put my understanding of medical issues into practice. This was when my grandmother was diagnosed with diabetes a few years back. I found myself conducting extensive research about the disease to educate myself about the ways in which we could manage her condition. The knowledge I gained, from understanding glucose levels to recognizing the effects of insulin, really proved invaluable. Despite my laid back approach to my own health, this experience showed me I","My mother was recently treated for breast cancer and just had her third of four chemotherapy sessions. She was initially told that she would not need chemo at all and would just have to do radiation to lower the rate of recurrence after the tumor and a lymph node was removed, and then a month later she had to very quickly reschedule, messing up work and therefore putting her insurance at risk. All of the complaints I've given you so far are incredibly fresh in my mind.","I tend to have a certain level of trust in doctors in general, owing partly to their professional training and experience. However, I am aware that they are human and can make mistakes. While I believe in their medical knowledge, I also understand that not all health issues can be addressed by relying entirely on them. I also value a doctor who takes the time to not only hear my concerns, but to explain things clearly and answer any questions I may have - it's this compassionate approach along with their expertise","So the surgery went incredibly well with only one nurse having poor bedside manner. The issue was the follow-up procedures. Radiation was all set up and ready to go before a sudden visit to the oncologist was scheduled. And we were informed that we were a month behind schedule. After that, suddenly radiation had to be pushed back over two months so four sessions of chemo could be forced through. We don't go to the first surgeon/general practitioner anymore. Apparently that's common with most surgeons: once they're done with you, you yourself don't need help anymore, even if you clearly do."
23,holdout_Text_Anxiety.jsonl,"Although I've the ability to obtain, process and understand basic health information, I feel that making the most appropriate health decisions may be a bit of a challenge. I often find the information inconsistent between sources, and even sometimes contradictory. I think there's a lot to be desired in how health information is disseminated and communicated to individuals like myself. It often feels like deciphering a puzzle rather than receiving clear, simple instructions on managing my health properly.","I have the capacity to obtain, process, and understand basic health information. The problem is whether I am informed enough to make appropriate health decisions regardless of how many questions I ask. If I need to know something it should be TOLD to me, and if I need a procedure immediately it should be scheduled immediately instead of them ignoring me for a month and setting up an entirely different procedure without consulting anyone before a different doctor tells me that I needed something different the whole time.","What makes me most anxious during a visit to the doctor's office is the unknown. Even though I generally understand medical information, I don't like not knowing what could come next. Are they going to order expensive tests? Are they going to give me bad news? The possibility of discovering an unforeseen health issue, even when I'm there for routine check-ups, makes me restless. I also worry about being rushed through an appointment without having an opportunity to express all of my concerns and ask all necessary","Money. I have no insurance so if there's something serious and I have to be rushed to the hospital, I will never be able to pay for it. I would rather they just leave me on the examination table to die than help at that point. I'm already in debt because of college loans; I literally can't afford to be in any more debt than I already am.","When one of my best friends was diagnosed with diabetes, I took it upon myself to understand her condition as well as I could. I researched extensively about different types and stages of diabetes, treatments, the impacts of diet and exercise, and even psychological factors. I also went with her to some of her appointments to learn more from her doctors. I wanted to be there for her in a significant way and I felt that understanding her medical condition was an essential part of that. I learned a lot through the","My mother was recently treated for breast cancer and just had her third of four chemotherapy sessions. She was initially told that she would not need chemo at all and would just have to do radiation to lower the rate of recurrence after the tumor and a lymph node was removed, and then a month later she had to very quickly reschedule, messing up work and therefore putting her insurance at risk. All of the complaints I've given you so far are incredibly fresh in my mind.","My trust in medical professionals was shaken due to my mother's recent experiences. The initial lack of communication, the sudden changes in treatment plans, and the overall rush to push through major decisions left me feeling quite disillusioned. It's made me feel like they're less interested in the patient's best interest, and more in following a standard procedure. These experiences have made me somewhat skeptical, as I now don't feel that doctors always provide the most precise or reliable advice.","So the surgery went incredibly well with only one nurse having poor bedside manner. The issue was the follow-up procedures. Radiation was all set up and ready to go before a sudden visit to the oncologist was scheduled. And we were informed that we were a month behind schedule. After that, suddenly radiation had to be pushed back over two months so four sessions of chemo could be forced through. We don't go to the first surgeon/general practitioner anymore. Apparently that's common with most surgeons: once they're done with you, you yourself don't need help anymore, even if you clearly do."
23,holdout_Text_Numeracy.jsonl,"As a college graduate, I believe I have the intellectual capacity to obtain, process, and understand basic health information. However, my major concern is in translating this theory into appropriate health decisions. To be honest, even though I understand the importance of health, I don't really prioritize it. I feel that making efforts to stay healthy doesn't necessarily guarantee lifelong health. Furthermore, my limited income does constrain my ability to access certain health services and to make optimal health decisions.","I have the capacity to obtain, process, and understand basic health information. The problem is whether I am informed enough to make appropriate health decisions regardless of how many questions I ask. If I need to know something it should be TOLD to me, and if I need a procedure immediately it should be scheduled immediately instead of them ignoring me for a month and setting up an entirely different procedure without consulting anyone before a different doctor tells me that I needed something different the whole time.","My biggest source of anxiety when visiting a doctor's office stems from a fear of the unknown. I get extremely anxious about receiving bad news regarding my health. Additionally, even though I trust doctors in general, I worry about whether they are taking my concerns seriously, or if they might overlook something important. Added to that, not having insurance and concerns about the financial repercussions of any needed treatment amplifies this anxiety immensely.","Money. I have no insurance so if there's something serious and I have to be rushed to the hospital, I will never be able to pay for it. I would rather they just leave me on the examination table to die than help at that point. I'm already in debt because of college loans; I literally can't afford to be in any more debt than I already am.","Around two years ago, my mother was diagnosed with breast cancer. She had to go through surgery, chemo, and radiation, and all through that period, I was the one taking care of her. I had to manage all of her medications, coordinate her doctors' visits and therapy sessions, and do everything else that she couldn't. It was a challenge, but it also taught me a lot about how to navigate the healthcare system, the side effects of different treatments, and the importance of emotional","My mother was recently treated for breast cancer and just had her third of four chemotherapy sessions. She was initially told that she would not need chemo at all and would just have to do radiation to lower the rate of recurrence after the tumor and a lymph node was removed, and then a month later she had to very quickly reschedule, messing up work and therefore putting her insurance at risk. All of the complaints I've given you so far are incredibly fresh in my mind.","I've had a mix of both positive and negative experiences with doctors in general. Some have been very empathetic, attentive, and responsive to my concerns which has instilled a sense of trust. However, I've also had experiences where I felt rushed or dismissed, which made me feel uneasy. There were instances where my concerns weren't taken seriously or I didn't feel the treatment plan was explained clearly enough. I also find it frustrating that sometimes doctors don't seem to have enough time for me,","So the surgery went incredibly well with only one nurse having poor bedside manner. The issue was the follow-up procedures. Radiation was all set up and ready to go before a sudden visit to the oncologist was scheduled. And we were informed that we were a month behind schedule. After that, suddenly radiation had to be pushed back over two months so four sessions of chemo could be forced through. We don't go to the first surgeon/general practitioner anymore. Apparently that's common with most surgeons: once they're done with you, you yourself don't need help anymore, even if you clearly do."
23,holdout_Text_SubjectiveLit.jsonl,"Honestly, it's a bit daunting at times. While I have a college degree, it's not in a health-related field so I can often feel quite overwhelmed when trying to navigate complex health information. I do my best to understand what I can, but medical jargon can be quite confusing. So while I can understand some basic health information, I still rely heavily on the expertise of my healthcare providers to guide my decisions. But, sometimes I worry if I'm making the right choices or if I","I have the capacity to obtain, process, and understand basic health information. The problem is whether I am informed enough to make appropriate health decisions regardless of how many questions I ask. If I need to know something it should be TOLD to me, and if I need a procedure immediately it should be scheduled immediately instead of them ignoring me for a month and setting up an entirely different procedure without consulting anyone before a different doctor tells me that I needed something different the whole time.","The thing that makes me most anxious is the uncertainty. Not knowing if there's going to be some unexpected health news or what they might find during an examination. It's the fear of the unknown and also the idea that something may be seriously wrong with my health, yet it’s out of my control. It can be quite overwhelming at times.","Money. I have no insurance so if there's something serious and I have to be rushed to the hospital, I will never be able to pay for it. I would rather they just leave me on the examination table to die than help at that point. I'm already in debt because of college loans; I literally can't afford to be in any more debt than I already am.","When I was in college, I took a nutrition class that really opened my eyes to the importance of a well-balanced diet. I started cooking for myself, and making sure I was getting all the necessary nutrients. I did need to go to the health center once for a minor issue, and the doctor there complimented me on my general health and the care I took of my body. Even though I don't feel that individual actions contribute significantly to long-term health, having that knowledge and making some","My mother was recently treated for breast cancer and just had her third of four chemotherapy sessions. She was initially told that she would not need chemo at all and would just have to do radiation to lower the rate of recurrence after the tumor and a lymph node was removed, and then a month later she had to very quickly reschedule, messing up work and therefore putting her insurance at risk. All of the complaints I've given you so far are incredibly fresh in my mind.","I have mixed feelings about physicians. On one hand, I understand that they're extensively educated and experienced in treating illnesses and general health maintenance. I respect that immensely. However, I can't shake the feeling that I'm often treated like a number rather than a person. It's a bit of an impersonal experience, and I find that troublesome when it comes to something as intimate as my health. I also worry about the cost, lack of time, and their ability to really understand my health issues","So the surgery went incredibly well with only one nurse having poor bedside manner. The issue was the follow-up procedures. Radiation was all set up and ready to go before a sudden visit to the oncologist was scheduled. And we were informed that we were a month behind schedule. After that, suddenly radiation had to be pushed back over two months so four sessions of chemo could be forced through. We don't go to the first surgeon/general practitioner anymore. Apparently that's common with most surgeons: once they're done with you, you yourself don't need help anymore, even if you clearly do."
